block_type,start,end,duration,segments,speaker_count,speakers,text
DJ/GUEST,2594.89,2631.82,36.93,3,2,"SPEAKER_09,SPEAKER_14",좋은 사람들과의 좋은 시간에 조금씩 치유되는 아이리스다. 마일스 DVD 가게에 같이 와줘서 고마워요 아직 여기 지리를 잘 모르잖아요 요즘 어르신이랑 같이 산책한다면서요? 네 여기서 좋은 친구들을 많이 만나서 참 좋아요 마일스랑 대화하는 것도 참 즐겁고요 그럼 좋은 친구인 제가 DVD 고르는 거 도와줄까요?
GUEST,2631.84,2683.41,51.57,6,1,SPEAKER_09,혹시 바람과 함께 사라지다 봤어요? 혹시 이런 내가 창피한가요? 오케이 오케이 오케이 그럼 조스는 어때요? 두음의 단순한 공포 설명이 필요 없는 곡이죠 아 재밌는 사람이네 어? 밖에 제 여자친구 뭐야?
AD,2683.43,2683.65,0.22,1,0,,옆에 저놈은 누구지?
DJ/GUEST,2694.53,2703.07,8.54,3,2,"SPEAKER_09,SPEAKER_14",마셔요. 따뜻한 차예요. 난 왜 바람둥이만 좋아할까요?
DJ/GUEST,2704.69,2725.59,20.9,6,2,"SPEAKER_09,SPEAKER_14",그건 내가 잘 알죠. 상대가 상처를 줘도 믿지 않아서요. 어쩌다 잘해주면 착각에 빠져서 아닌 걸 알면서 오리네요. 맞아요. 아니 이틀 촬영하고 그 뺀질인 녀석이랑 함께 지냈대요. 아침에 통화했을 때도 멕시코랬는데 실은 LA에 있었던 거죠.
AD,2725.61,2725.67,0.06,1,0,,에휴.
DJ/GUEST,2727.07,2770.6,43.53,9,2,"SPEAKER_09,SPEAKER_14",음 마일스 다 안다고 하면 화가 나겠지만 나 정말 그 맘 알아요 나도 영국에서 양다리를 경험했거든요 매일 밤 자책했어요 내가 뭘 오해했나 그러다 그가 또 돌아오길 바라죠 아 언젠간 이 고통스러운 시간도 잊혀지겠죠 하이리스 그래서 여기 온 거예요 잊으려고 우편으로 원고 보낸 그 남자죠 맞아요. 어떻게 알지. 늘 나한테 도움을 청해요. 그러니 못 잊죠. 그놈은 좋겠지만. 이리 와요. 내가 파스타 만들어 줄게요. 이브니까 발코니에 앉아서 같이 먹어요.
DJ/GUEST,2770.62,2777.91,7.29,3,2,"SPEAKER_09,SPEAKER_14",마일스 당신은 참 좋은 사람이에요. 알아요. 그래서 매력이 없죠.
DJ/GUEST,2798.07,2863.4,65.33,6,2,"SPEAKER_09,SPEAKER_14",마일스 작업실에 초대해줘서 고마워요 에이 뭘요 어르신이 이번에 시상식에 나가니까 노래를 만들어서 선물하려고요 이 곡 어때요? 아 인디아나 존스잖아요 그 존 누구였지 존 윌리엄스 노래? 아 들켰다 내가 만들었다고 우기려고 했는데 당신 테마를 썼어요 당신을 멜로디로 표현하면 밝은 음만 썼어요 맥이에요 여보세요? 잘 지내 저기 실은 나 누구랑 같이 있어 글쎄 몇 시까지? 알았어 내가 그립대요
DJ/GUEST,2866.62,3045.19,178.57,9,2,"SPEAKER_09,SPEAKER_14",얼른 가봐요 이따 어르신 시상식에서 봐요 웬만하면 시상식에 갈게요 근데 얘기가 좀 길어질 것 같아요 걱정마요 잘 되길 바랄게요 잠깐 집에서 쉬다 나가야겠다 아 여보세요 아 제스퍼 아 원고 이제 읽으려고 아 있다니 그냥 좀 바빴을 뿐이야 깜짝 놀랄 일? 문 밖에 뭘 보냈다고? 못 봤는데 잠시만 제스포 자기를 꼭 만나야 해서 왔어 정말 이해가 안 되네 자기는 우리가 안 맞는다며 기억 안 나 어쨌든 그리웠어 당신 소식이 없으니까 돌겠어 자기를 잃긴 싫어 이리 와 진심이야? 그럼 그 여자는 정의했어? 내 상황 알잖아 그냥 받아들여줘 어우 세상에 또 넘어갈 뻔했네 3년 전에 쌀 할 말이 있어 지금 할겐 제스퍼 당신은 날 이용했어 맞지? 이제 우린 정말 끝이야 왜 이렇게 변했어? 뭐 여기 와서 당당히 사는 법을 배웠나 보지 당장 나가 드디어 긴 감옥에서 탈출한 아이리스 가벼운 마음으로 어르신의 시상식에 참석한다 뒤늦게 달려오는 마일스 아이리스처럼 해방의 눈빛이다 이제 끝났어요 완전히 근데 당신 참 예쁘네요 아이리스 올해 마지막 날 밤 뭐 할 거예요?
DJ/GUEST,3045.21,3089.74,44.53,5,2,"SPEAKER_09,SPEAKER_14",영국에 가 있겠죠 난 유럽엔 못 가봤어요 혹시 내가 가게 되면 같이 송년 파티 할래요? 좋아요 일단 키스부터 할까요? 창밖에 눈은 소복하고 벽난로에 불은 따뜻한 오두막집. 즐거운 이들의 송년 파티가 한창이다. 아이리스와 마일스의 행복한 웃음이 굴뚝을 타고 높이 퍼진다.
AD,3094.18,3315.34,221.16,47,9,"SPEAKER_02,SPEAKER_06,SPEAKER_07,SPEAKER_11,SPEAKER_12,SPEAKER_13,SPEAKER_16,SPEAKER_17,SPEAKER_24","가마치 통닭 크리스마스엔 따끈한 가마치 통닭 고려기부트로 선수교체 매출 쭉쭉 성과 쭉쭉 반성과 공공기관 우선구매 대상기업 고려기프트 건너오세요 당신의 퇴직연금이 원하던 글로벌한 세계로 내 연금상품 그대로 중도해지 없이도 실물이전은 지금이다 수익률이 중요한 퇴직연금은 글로벌 투자하는 연금 미래에셋증권으로 원금 손실 유의. 투자 전 상품 설명서 및 약관 필독. 아 병원 갈 때 신분증 챙기기 귀찮아. 괜찮아. KB 스타뱅킹이 있잖아. 병원 접수할 때는? KB 스타뱅킹이면 괜찮아. 여권 재발급도? KB 스타뱅킹이면 괜찮아. 국내선 비행기 탈 때도? KB 스타뱅킹이면 괜찮다니까. 신분증 챙기기 귀찮은 모든 순간. 지금 KB 스타뱅킹에 신분증을 넣어보세요. KB 국민은행. 대한민국 지역균형 발전의 미래. 태만금 수변 도시가 2025년 모습을 드러냅니다. 경제, 문화, 교육, 여가가 어우러지는 새만금 수변 도시는 차별화된 가치를 제공하며 대한민국 미래 도시로 발돋움할 것입니다. 이 광고는 새만금개발공사와 함께합니다. 안녕하세요. 신한 프리미어 모델 김수현입니다. 여러분께 특별한 자산관리를 소개합니다. 투자, 법률, 세무, 부동산. 각 분야 전문가들이 당신만을 위한 맞춤 솔루션을 찾아드립니다. 지금 만나보세요. 자산관리는 신한프리미어. 아빠, 이제 담배 냄새 안 난다. 전자담배, 처음엔 좋았습니다. 절 피하지 않으니까요. 우와, 이 냄새 뭐야? 근데 이제 무섭습니다. 피하지 않으니까요. 피하지 않아 더 위험한 전자담배. 전혀 괜찮지 않은 담배입니다. 이제 파스 고를 때 테크놀로지를 따져보세요. 통증 완화 테크, 염증 케어 테크, 통기성 테크까지. 이 모든 테크를 한 장에. 개펜 테크. 통증엔 빠르게, 피부는 편하게. 저 지진이처럼 통증엔 테크하세요. 개펜 테크. GLS 사이언스. 단순 감기인데 무슨 구급차야. 119 응급의료상담서비스를 이용해주세요. 비응급신고를 자제하고 119 응급의료상담서비스를 이용하면 더 많은 생명을 구할 수 있습니다. 이 캠페인은 소방청과 함께합니다."
DJ/GUEST,3315.36,3410.49,95.13,11,2,"SPEAKER_09,SPEAKER_14","시내타운에서 준비한 상품입니다. 백화점 상품권, 급발진 잡는 지넷에서 한문철 블랙박스, 에스테틱 브랜드 라시뎀에서 당 독소 감소 오일, 도드람 양돈 협동조합에서 우리돼지 한돈 선물세트, 호신용품은 블랙코브라에서 든든한 호신용 전기충격기 기억된 향기 줄라이 모닝에서 프리미엄 헤어케어 세트 뷰티 리추얼 라라클라라에서 엑소존 바이오 니들 크림 피부장벽 개선 비슈띠에서 고보습 기초 3종 세트 모발케어 명가 나투리아에서 테라틴 워터팩 아름다운 비주얼 아비주 뷰티에서 뷰티상품권 건강한 아름다움 올린드에서 샴푸와 트리트먼트 세트 북기 고민 해결 북이로우에서 간편 수분 밸런스 칼륨제 명품 향기 가득 버블큐브에서 조향사 콜라보 캡슐 세제 골프 마스크 바벤스미스에서 자외선 차단 마스크 뷰티 브랜드 방클레오에서 클렌징 오일과 초밀착 쿠션. 글로벌 클린 뷰티 올릭에서 올릭 그린 선스크림. 행복을 담은 커피 워너빈에서 드립백 커피 세트를 드립니다. 오늘의 릴스 무비는 로맨틱 홀리데이로 꾸며드렸죠. 어떠셨어요? 저도 겨울만 되면 이 영화가 생각이 날 정도로 저는 굉장히 재밌게 봤던 영화라서 또 다른 마일스 아일리스 말고 또 다른 얘기가 있잖아요. 케메론 디아즈 주드로 씨가 함께한 그 이야기도 좀 있었으면 좋았을 텐데 아쉬움도 한편으로도 들기도 하고 다음에 하면 되죠."
DJ,3410.47,3438.35,27.88,1,1,SPEAKER_14,쿨하셔 역시 저는 뭐 당장 나갈게 당장 나가 너무 시원했어요 나쁜 X들 지영님이 당신은 여주인공인데 조연처럼 행동하고 있다는 영화 속 어르신의 말이 계속 기억에 남는데요 맞아요 우린 제 인생의 주인공입니다 모두 맞습니다 오늘도 감사합니다 끝인사 해주세요 시원하게 오늘도 영화처럼 나쁜 사람
AD,3447.14,3620.08,172.94,27,7,"SPEAKER_07,SPEAKER_10,SPEAKER_12,SPEAKER_13,SPEAKER_16,SPEAKER_17,SPEAKER_22",모든 인쇄 가능한 성원 에드피아 온라인 주문 간편한 성원 에드피아 누구든지 어디서나 쉽고 빠르게 인쇄의 유토피아 성원 에드피아 캘린더 주문도 역시 성원 에드피아 국민 인쇄 성원 에드피아 일하다 건강이 나빠졌나요? 당신도 직업병일 수 있습니다. 나도 모르는 사이 시작된 직업병을 찾기 위해서 나와 일터를 건강하게 만드는 직업병안심센터를 찾아주세요. 문의 1588-6798 고용노동부 직업병안심센터 한국 뮤지컬 어워즈 작품상 수상자 뮤지컬 리지 미국 전역을 충격에 빠뜨린 살인사건이 강렬한 로그막으로 다시 태어났다 사건을 둘러싼 비밀과 진실이 파격적이고 짜릿한 퍼포먼스로 펼쳐진다 대치불과 카타르시스 뮤지컬 리지 12월 1일까지 두산 아트센터에서 두통 참을까? 치통 견딜까? 생리통 버틸까? 통증 다 잃지 말고 개보린 한 알로 빠르고 말끔하게 한 알로 싹 두통 치통 생리통엔 한 알로 싹 맞다 개보린 삼진제약 이 소리는 더경기패스 가입자들의 환급금 쌓이는 소리입니다. 그래서 이번 달에도! 우와! 2만 9천 원이나 꽂혔어! 우리 내 식구 환급금 맞추면 8만 원이 넘는데? 이거네! 벌써 100만 명이나 쓰는 이유! 환급이 무제한 더경기패스! 고속도로 달리다 사고가 났다. 어떡하지? 쿵쾅대는 내 심장 너무나 무서워. 어떡하지? 고속도로 사고 시엔 도로 밖으로 무조건 대피 꼭 기억하세요. 이 캠페인은 한국도로공사와 함께합니다. 꿈을 향해 숨 무엇이든 이룰 수 있어 평생 무효 쏴 언제든지 할 수 있어 숨싸가 함께할게 숨쉴 사이버대학교 제2의 인생을 향해 숨쏴 콘텐츠가 강한 대학 숨쉴 사이버대학교 안녕하세요. 유현석입니다. 여러분의 틈새 시간에 행복을 선물하는 틈만나면이 더욱 큰 웃음으로 돌아왔습니다. 매일 쉼없이 돌아갑니다.
