block_type,start,end,duration,segments,speaker_count,speakers,text
DJ/GUEST,4358.35,5129.09,770.74,92,2,"SPEAKER_04,SPEAKER_09","그대 예쁜 목소리로 자장가를 불러줘요 오늘 밤도 그대 내 꿈속에 나와 함께 살아요 아이 같은 그 미소로 나를 보며 웃어주네요 나는 그대라서 첫 번째 그대의 마음 나무처럼 나를 쉬게 해 두 번째 그대의 미소 햇살처럼 나를 밝게 비추고 세 번째 그대의 손길 내가 힘들 때마다 품에 안아줄 내가 슬플 때나 외로워할 때 내 곁을 따스히 지켜주던 그대란 사람 어찌 말을 해야 할까요 네 번째 그대의 온도 내 가슴을 따스하게 다섯째 그대의 눈물 더 열심히 나를 살아가게 해 여섯째 그대의 기도 젖은 어깨를 비게 만들어주 더 이상 눈물은 이제 흘리지 말아요 영원토록 그대를 지킬게요 사랑하는 그댈 보며 바라만 봐도 난 행복해요 여덟째 그대 목소리 내게 힘을 주는 그대이니까 아홉번째 그대의 걸음 못난 날 매일마다 찾아와주네 열번째 그대란 선물 그대라서 난 정말 행복해 이은지의 가요광장 노래 듣고 왔습니다. 이석훈 그대를 사랑하는 10가지 이유. 취재들 1월 17일이요. 청취자분들과 텐디가 만난지 텐디가 디스크 자키를 맡게 된지 천일이 되는 날이라 오늘은 광장맞게 다 있어. 청취자분들과 이제 토크토크하며 노는 시간 보내고 있는데 주제가 가요광장이 깜짝이야 동굴로 들어왔어. 가요광장이 실제로 여러분들께 미치는 영향에 대해서 우리가 이야기 나누고 있습니다. 좋은 영향이어야 될 텐데 그래서 저희가 어쨌든 사연 소개되신 분들께는 치킨 상품권 보내드리고 있고요. 오늘 이 시간 총 3분 뽑아서 100만 원 상당의 음식물 분쇄기 처리기 교환권 이용권 보내드리고 있어요. 그렇기 때문에 여러분 교환권이네요. 만관부 김지현님 좀 밝아졌어요. 친구들이랑 걷다가 갑자기 물들어 불러버리고 좋은 방향 맞겠지요. 맞지요 맞지요 좋은 방향이지요. 그리고 친구들이랑 걷다가 이렇게 또 노래를 부르면 일단 친구들이 좀 창피해할 수 있거든요. 주위에 있는 사람들이 조금 창피해할 수 있지만 그런 것들을 다 견뎌내는 어떤 그런 강인함이 또 장착이 돼요. 물들어 노래 불렀을 때 주위 사람들이 창피해 하겠지만 그 창피함을 견뎌내는 나 멋져 이런 생각을 하실 수가 있고 그리고 이게 접지 능력이 좋아져요. 성대 접지 능력이 좋아지기 때문에 어딜 가서도 갑자기 노래를 시켰을 때 할 수 있고 물들어라는 노래는 여러분 또 우리가 활용할 그런 소재가 많았잖아요. 정말 많았다니까요. 예를 들어서 왁싱샵에 가서도 텐디가 이 노래를 응용을 할 수 있다 왁싱샵에 가서도 안녕하세요 저 겨드랑이 털 제거하러 왔는데요 아 그러세요? 겨드랑이 들어 왁싱 잘 할 수 있도록 겨드랑 들어 왁싱샵 피디님 어디 가셨어요? 웃음 터져서 고개 숙이신 줄 알았어요. 이렇게 겨드랑도 들을 수가 있고 지금 오픈 스튜디오에도 귀여운 강아지가 나타났습니다. 이 강아지도 충분히 물들어를 응용할 수 있어요. 강아지야 강아지야 너 애견 미용하러 왔니? 그래 너의 슬개골 쪽을 내가 미용을 잘 시켜볼게. 우리 강아지 강아지 슬개골들아 이런 식으로 물들어를 응용을 할 수 있고 어디 가서도 이 노래를 부르면 스타가 될 수가 있어요? 어디 소속사 내가 대표야? 스타가 될 수가 있고 이목을 받을 수 있어 좋은 영향이 있다. 지연님 고마워요. 이승윤님 저는 6년 사귀던 여자친구랑 같이 동업을 했거든요. 헤어지고 모든 걸 정리하고 혼자 가게 운영을 하다 보니 너무너무 힘들었습니다. 근데 가요광장 들으면 억지로라도 웃고 이별도 가게 운영의 어려움도 극복했어요 그 시간들을 견디게 극복하게 해주셔서 고마워요 승윤님 텐디한테 또 이렇게 문자사연 보내주셔서 너무너무 감사드리고 힘이 됐으면 좋겠습니다 늘 ENG의 가요광장 많이 들어주셔요 김가인님 가요광장에 사연이 소개됐었는데요 5년간 연락 끊긴 친구가 너야? 하고 연락이 온 적 있어요 친구 사이도 다시 이어주는 가요광장은 사랑을 싫고 우와 대박이다 옛날에 진짜 사랑을 싫고라는 프로그램에서 첫사랑 찾아주기 선생님 찾아주기 이런 사연들이 있었잖아요 근데 우리 가인님이 실제로 지금 그런 사연을 받으신 거예요? 어? 가인님 너무너무 감사드리고 고맙습니다. 박수치고 떠남교님 저는 회사 다닐 때부터 들어서 그런가 가광에서 신나는 노래가 나오다 보니 bpm 180 이상만 찾게 돼요. 좀 잔잔하게 지내고 싶은데 말이죠. 근데 텐디도 이 가요광장에서 워낙 bpm 180, 140 이런 댄스곡 신나는 음악들이 많이 나오다 보니까 평소에 텐디는 약간 잔잔스 요즘에 좀 빠져있어요 또 최근에 너튜브 72시간의 소개팅이라는 컨텐츠를 봤는데 플레이리스트가 장난이 아닌 거예요. 근데 거기 약간 플레이리스트가 다 약간 그런 잔잔 바이브 뭔가 검정치마 이런 느낌 있죠. 이런 느낌이에요. 그래서 가요광장 생방송할 때는 또 댄스곡에 또 심취해 있지만 또 혼자 있는 시간은 약간의 그런 나즈마한 노래 아주 좋아요. 따마 이런 노래. 소울, R&B gear, 리듬앤블루스, 텐디 좋아합니다. 박수친구 떠남규님 아유 사연 감사드리고요. 9137님 언어능력이 퇴화를 언어능력 퇴화를 막아주는 효능이 있습니다. 10개월 육아중이라 맘마 빠빠 엄마 하삐 까까만 말하느라 어른들과 이야기하면 말이 잘 안나왔거든요. 가광들어서 그래도 덜 퇴화한거 같아요. 아이고 다행이네요. 9137님 이게 어쨌든 진짜 이 육아, 육아를 하다 보면 그래도 그냥 이렇게 말통하는 사람들이랑 얘기하는 것만으로도 좋아. 막 이런 마음 들 때가 있거든요. 고유삼칠님, 육아하실 때 이은지의 가요광장 많이 많이 들어줘요. 너무너무 감사할 것 같고요. 1102님. 제가 진짜 귀가 예민하거든요 목소리 데시벨을 좀 높거나 약간 시끄럽다 싶으면 참을 수가 없었어요 근데 가을광장 듣고 우리 텐들을 만나고 나서 달라졌어요 시끄러운 게 좋아요 그냥 나 은지가 좋아요 이렇게 1102님도 적응이 되는 거예요. 이게 적응의 동물이고 텐디가 물론 시끄럽고 노래도 부르고 춤도 추고 별의별 일을 다 하지만 1102님 한번 좀 들어봐요. 약간 감식초 같은 매력이에요. 감식초도 처음에 먹어보면 이게 무슨 말이야? 무슨 맛이야? 이렇게 할 수 있지만 또 먹다 보면 또 함께하다 보면 또 이 맛이 매력을 알 수가 있듯이 1102님 감사해요. 이제는 웬만한 아침에 공사장 소음 소리도 버텨낼 수 있는 그런 달팽이관. 맞나? 달팽이관 맞나? 귀에 있는 거? 달팽이관을 갖게 되실 거예요. 1102님 사연 너무너무 감사드리고요. 김장환님. 그런데 나는 스카스카 배웠음. 추임새 스컬스컬 와이프가 뭐냐고 그래도 스컬스컬 텐디도 사실 스컬스컬 뜻을 모른 채 쓰다가 그때 우리 게스트분 중에 한 분이 또 친절하게 설명을 해주셨었어요 스컬스컬에 대한 자동차 끼익 할 때 뭔가 스컬 약간 이런 느낌 뭔가 힙합 문화의 어떤 추임새 끼익 그런 느낌이라고 또 얘기를 해줬고 자동차가 끼익! 쓰는 소리가 스컬! 이라서 그걸 힙합하는 사람들이 스컬스컬! 이 추임새를 한다는 것을 텐지도 가요광장을 통해서 배웠고 그러고 또 많은 추임새들이 있었죠 스컬스컬도 있고 끄르르르 뭐 이런 것도 있고 뭐 이런 것도 있고 이렇게 시끄러운데 우리 아무튼 이런 걸 다 1102님이 감내하셨다라는 거죠? 그렇다면 1102님께 음식물 분쇄 처리기 교환권을 드립니다. 고생하셨어요. 1102님 너무나도 시끄럽고 정신없고 녹록치 않은 가요광장 들어주셔서 감사드리고 텐며 들어주셔서 너무나도 감사드립니다. 노래 흐르네요. 아이고 BMK의 물들어 들려드리면서 우리는 이따 만나요."
AD,5129.11,5443.49,314.38,16,7,"SPEAKER_02,SPEAKER_08,SPEAKER_11,SPEAKER_13,SPEAKER_15,SPEAKER_19,SPEAKER_25","물이 얹은 너의 손 나는 잊을 수가 없어서 네 아픈 가슴을 너의 익숙함으로 다시 감싸줘야 해 나에게 너의 손이 닿으면 나는 점점 물들어 너의 색으로 너의 익숙함으로 나를 모두 버리고 물들어 너의 사랑 안에 나는 물들어 너의 사랑 안에 나는 이제 널 위해 변해가는 걸 이제 모두 버리고 손끝으로 파고 와 목을 스친 상처로 심장 안에 머물며 나는 이제 너에게 사업장이 여러 갠데 매출, 매입, 지출, 계좌 현황을 한눈에 쉽게 볼 수 없을까? 여러 사업자의 격리 업무도 이제 한 번에 쉽고 편하게 격리회계 프로그램 세계 미술사를 바꾼 인상파의 원화가 노원에 옵니다. 모네, 고흐, 세잔, 르누아르까지 빛과 색채의 혁명을 만든 거장들의 원화를 놓치지 마세요. 노원아트 뮤지엄에서 12월 19일부터 5월 31일까지 지금 인상파 찬란한 순간들을 검색하세요. 살면서 제가 2시를 기다려본 적이 없는데 파디 덕분에 그래도 매일매일 힘을 얻는 것 같습니다. 파디 이제 곧 52시니까 야! 2시가 기다려지는 라디오 안녕하세요 여러분 항상 유쾌한 텐션으로 하루를 밝혀준 우리 하하 유쾌한 텐션으로 하루를 밝히는 라디오 슈퍼라디오 이제부터 더 잘하고 아빠가 영원하면 좋겠어요 청취자 여러분과 영원히 함께하고 싶은 라디오 KBS 쿨 FM 하하의 슈퍼라디오와 함께해주세요 판총물 대박날까 불안하네 이윤지의 가을광장"
DJ,5443.82,5833.42,389.6,50,1,SPEAKER_04,KBS 라디오 이은지의 가요광장 4부 시작했고요. 저는 텐디 이은지입니다. 광장마켓 다 있어. 오늘의 주제 가요광장이 천일 동안 당신에게 미친 영향 취재들 가요광장과 함께하며 여러분에게 생긴 변화 변동 움직임 전환 기복 다양하게 받아보고 있습니다. 1957님 저희 딸은 이은지의 가요광장을 외쳐주면 웃는답니다. 거짓말 같겠지만 진짜예요. 매일 엄마랑 같이 듣거든요. 그래서 작년 애기 돌잔치 사진 촬영하면서 남편이 이은지의 가요광장. 외치면서 사진을 찍었어요 그랬더니 사진 작가님이 그게 뭐예요? 애기가 라디오를 들어요? 그래서 그렇다고 했더니 엄청 웃으셨어요 가요광장 덕분에 돌잔치 스냅을 잘 마쳤답니다 감사 바쁘다 아빠 현대사회 아이고 1957님 이 돌잔치 스냅 사진 찍는 거 보통 일 아니고요 이게 또 돌상에 아이를 이렇게 올려놓으면 우리 아빠들도 굉장히 불편한 옷을 입고 돌상 뒤로 가서 쭈그린 채 손바닥으로 아이를 받치고 있어야 돼요. 그렇기 때문에 돌 사진을 이렇게 보면 아이가 혼자 이렇게 굉장히 멋지게 앉아있는 것처럼 보이지만 사실 뒤에서 아빠가 이렇게 뒤에서 엄청 열심히 쭈그려가지고 그리고 저기 옷도 되게 불편해요 아빠들 왜냐하면 돌잔치 때 살이 좀 쪄요 왜냐하면 어쩔 수가 없는 게 출산을 하고 나면 육아하면서 육아 퇴근하고 엄마랑 아빠랑 야식 먹고 그리고 못 먹었던 술도 조금 먹고 그러면서 살이 많이 쪄서 엄마 아빠들이 늘 하는 이야기가 살이 많이 쪘다 돌잔치 때 그 얘기를 진짜 많이 해요 그러면 어떻게 돼요 아빠 바지가 좀 작아요 근데 그럼에도 불구하고 아빠가 이렇게 쪼그려 앉아가지고 아킬레스건 아킬레스건이 이렇게 좀 굉장히 이렇게 눌리는 그런 고통을 참으면서도 우리 아이를 이렇게 등을 바치고 있단 말이에요 그렇게 해서 돌잔치 사진을 찍어내는 거예요 아우 1957님 문자 하나로 지금 몇 분을 얘기한 거예요 제가 아우 너무 감사드리고요 아우 쏘 땡큐 땡큐 5990님 중2병 단단히 걸린 딸 때문에 혈압이 오를 때마다 지나간다 사춘기를 생각하며 힐링도 했고요 딸이 좋아하는 보이 넥스트 도어가 게스트로 나온다는 이야기를 듣고 딸과 함께 들으며 공감대를 조금 더 맞추기도 했어요 덕분에 조금 부드러워진 딸과의 대화가 모두 가요광장 덕분인 것 같아요 아 러브 텐디 오 990 님 텐디도 진짜 재밌는 문자들 많이 온다니깐요 아까 어떤 문자에서는 우리 아들이 악귀가 씌였어요 기분이 좋았다 나빴다 이놈의 사춘기 이런 문자가 와요 너무 웃기잖아요 아무 말도 없이 그냥 저한테 문자가 온 거예요 우리 아들이 악귀가 씌였어요 기분이 좋았다 나빴다 좋았다 나빴다 이 사춘기 어떡할까요 이런 문자가 와요 그때마다 텐디가 늘 이야기했던 이야기했던 말이 있잖아요 어쩔거냐 사춘기 지나간다 갱년기 바쁘다 바빠 현대사회 녹록치 않아 사회생활 어쩔거냐 사춘기 지나간다 갱년기 요거를 이렇게 계속 이야기하면서 우리 취자들이 좀 마음을 다잡았나요? 오 990님 사연 너무너무 감사드리고 2428님 특별한 영향은 없고요. 사람들 만날 때 주로 그냥 TV 프로 얘기하다가. 나는 그냥 가끔 라디오 얘기해요. 이은지의 가요광장 얘기. 약간 이런 톤으로 문자가 왔지요. 딱히 이은지의 가요광장 좋아하는 건 아닌데. 들으니까 괜찮던데. 니들 알아서 해라. 난 니들이 가자고 하는 대로 갈게. 약간 우리네 아버지 같은 느낌 살짝 있네요. 2428님 듣고 계세요. 특별한 영향은 없다고 하셨지만 느낌적으로 매일매일 듣고 텐디의 매일매일을 함께 해주시는 것 같아요. 2428님 듣고 있어요. 사연 감사드립니다. 6480님 안녕하세요 텐디. 텐며든 20대 소녀입니다. 원래는 일할 때 음악 듣다가 완전 라디오에 빠져서 이제는 음악만 들으면 심심해서 다시 라디오로 돌아오게 되더라고요. 어느 순간 텐디가 뭐뭐했간 이런 말투를 많이 사용했는데 그거에 저도 물들어서 부모님이랑 남자친구한테 밥 먹었간 오늘 뭐하고 놀고 있간 이랬다가 무슨 말투냐고 놀림당했어요 텐디 오늘도 텐션 미쳤간 아 요거는 이제 저희 텐디 엄마 말투고 이게 충청도 사투리일걸요 내가 뭐라 했간? 내가 뭐라고 했게? 뭐 이런 것 같아요. 내가 뭐라고 했게? 내가 뭐라고 했어? 이런 느낌인데 내가 뭐라 했간? 뭐 약간 이렇게 이게 또 최근에 텐디랑 이야기를 많이 했죠 크리스마스 즈음이었던 것 같아요 산타가 선물을 주간 이걸로 인하여 이게 발생됐던 이야기 8620님 가강을 듣고 난 후에는 웬만하면 당황스러운 일엔 당황하지 않아요 텐디가 적응력을 훈련시켜줬어요 그쵸 노래 부르고 춤추고 갑자기 뭐 화장실을 간다든지 갑자기 텐디가 아닌 다른 게스트가 백호씨 그런 분들이 또 대화를 한다든지 말을 한다든지 뭐 그런 다사다난한 일들 깜짝 놀랄 일들 정말 정말 많지만 그럼에도 불구하고 12시부터 2시까지 텐디 라디오 들어줘서 너무너무 고맙고요. 7355님 광장이 들어오며 달라진 점 출퇴근 시간에만 키던 라디오를 한낮에도 켠다는 점 라디오를 들으려고 낮시간 외근을 많이 신청하고 있습니다 라면서 텐디한테 신청곡도 띄워주셨어요 7355님 오늘도 너무너무 감사드리고요 아 참 많은 분들이 또 이은지의 가요광장으로 문자사연 보내주셨는데요 우리 2428님께 100만원 상당의 음식물 분쇄기 처리 교환권 나머지 분들은 저희가 치킨 상품권 보내드릴게요 7355님의 신청곡 지금도 외근 중이세요 7355님 신청곡 띄워드릴게요 뉴진스 ETA
AD,5841.36,5979.34,137.98,4,1,SPEAKER_10,다음 비하지만 이 시간은 은행 서툴러서 정리해 Can I real bad 받아주면 안 돼 I know you better trust me 답답해서 그래 내 새끼 파티에 너만 먹던 그날 여진이가 엄청 혼났던 그날 지원이 걸친 이라 헤어진 그날 그는 언젠가 너가 없이 그날 너만 멋있는 옷을 입고 그날 heard him say we can go wherever you like baby say the words in my mouth 내 생일 파티에 너만 못 온 그날까지 네가 엄청 혼났던 그날 지원이 걸친 이라 여친 그날 그냥 언젠가 너가 없이 그날 너무 멋있는 옷을 입고 그날 heard him say we can do whatever you like baby say the words and move on 안녕히 계세요.
DJ,5984.63,6334.08,349.45,34,1,SPEAKER_04,뉴진스 ETA 듣고 왔습니다. 오늘은 이은지의 가요광장 광장마켓 다이써 청취자분들이 가요광장이 여러분에게 미치는 영향 어떤 영향인지 청취자분들께 가요광장이 미치는 영향이 무슨 영향인지 대화 나누고 또 선물 보내드리고 있는데요. 0897님 저는 사무직으로 일하고 있는데요. 사장님께 커피 드릴까요? 한다는 것이 저도 모르게 커피 몇 잔 할래요? 라며 말해버렸습니다 그리쪼니 사장님께서 나도 그거 들어 가광이라고 하나 이러면서 사장님과의 거리가 조금 가까워졌어요 08974 아이고 저희가 뭐 커피면 전화할래요 요 시간도 있고 세상의 모든 은지 요 시간도 있고 그리고 뭐 방캐 웬만하면 다 소리를 지르네 방캐 싸라다 뭐 이렇게 하는 시간도 있고요 토요일은 또 굉장히 행복한 시간이라서 텐션을 조금 더 높게 텐디가 하는 경향도 좀 있는 것 같아요 0897님 가요광장 많이 많이 들어주셔서 너무너무 감사드리고요 7862님 좋은 점도 있지만 단점이 있는데 나 이런 단점 이야기하는 거 좋아해요. 어지간한 텐션으로는 제 흥을 끌어올릴 수가 없어졌어요. 미친 텐션으로 낮이 더 이상 잠 오는 시간이 아니게 되었어요. 그래요. 이 말은 즉슨. 도파민을 맛본 자 아 웬만한 도파민은 충족이 안된다 뭐 텐디가 그렇게 해석을 좀 해도 될까요 텐디에게는 도파민이 우리 취자들의 문자 사연들이에요 이거 보고 있으면 재밌는 이야기가 진짜 많이 올라오고요 아 막 웃긴 얘기 재밌는 얘기 그냥 일상들 지금 상황들 그런 것들 보면서 텐디도 이렇게 재미나게 보고 있다니까요 7861님 사연 감사드리고 최수진님 오 저 여기 가광에서 아이돌 여럿 입덕했어요. 여돌은 아일리잇 남돌은 투어스 가광 초대석 누구세요를 통해 또 매력이 빠지셨군요 수진님 사연 감사드리고 22336님 아 그래 그래 그래 그럴 수 있겠다 이게 어쨌든 전화 연결이 되는 게 좀 부담스러운 분들도 있겠지만 또 기다리시는 분들도 있을 수 있잖아요. 또 전화 연결을 하고 나면 텐디랑 토크토크도 하고 어쩔 땐 노래도 부르고요. 우리 옛날에는 광장코인 노래방 광코너 때 허밍 퀴즈도 있었어요. 컨텐츠가 넘쳐났다니까 컨텐츠가 넘쳐나가지고 우리가 허밍 퀴즈하는 시간도 있었고 취자들이랑 또 가끔 전화 연결하는 시간이 있으니깐요. 혹시라도 또 전화 연결 원하시는 분들 전화라고 말머리 달아주십시오. 그럼 저희가 전화 전화 바로 걸어봅니다. 아시겠죠? 그리고 왠지 2336님은 혹시나 청취율 조사 전화 리서치 전화일까봐 또 받아보시는 경우도 있는 것 같아요. 헉! 감사해요 2336님 6716님 텐디와 가요광장이 나에게 미친 영향 드립이 들었다 원래 한 드립치는 나지만 그래도 텐디가 읽어주고 빵 터져주면 뭔가 인정받은 것 같고 으쓱함 안 읽히는 날에는 나의 노잼 드립력을 반성하게 되는 계기가 됨 우와 멋져 왜냐하면 6716님 이거 되게 뭔가 거의 지금 수학 경신에 나가서 내가 이 문제 왜 틀렸지 하는 수준으로 분석하는 이 모먼트 너무 멋지고요. 마치 AI처럼 이런 어떤 자료 확보 자료 조사 분석 그리고 결론 도출까지 나왔어요. 나 이렇게 너무나도 멋진 모먼트를 가지신 우리 6716네 감사드리고요 텐디도 알아요 뭔가 괜히 누가 내 얘기에 빵빵 터져주면 자존감 많이 올라가잖아요 기분 좋잖아요 텐디도 너무 잘 알고 웃기지 않아도 되니 드립이 뭐 약해도 되니 그냥 하루하루 일상 이야기해주시는 거 텐데 너무너무 좋네요 여수종님 제가 뽑은 가광 명장면 탑1은 바로바로 투모로우바이투게더 데자뷰 라이브 고라니니 나님입니다 아직도 아침에 힘들 때 챙겨봐요 덕분에 데자뷰라는 좋은 노래도 알게 되었고요 항상 리액션 최고 텐디 천일 축하해요 소정님 오랜만에 오신 것 같은데요 우리 소정님 사연 너무너무 감사드리고 또 천일 동안 텐디와 함께 해주셔서 너무너무 감사드립니다 김신혜님 가광 들으면 텐디가 항상 업되어 있는 건 아니고요 진지하게 취자들에게 눈높이를 잘 맞춰주면서 참여와 공감도 이끌어줘요 DJ 중에 단연 최고 아니 only one 보아의 only one 듣고 싶어요 신혜님 텐디 또 칭찬 칭찬 너무너무 감사드리고 소문 많이 많이 내주십시오 아시겠죠 소문 많이 많이 내서 2인치의 가요강장 많은 사람들이 들을 수 있도록 좀 도와주세요 6716님께 선물 보내드리고 싶습니다 이렇게 분석 멋진 분석과 결론 도출하신 6716님께 음식물 분쇄기 처리 교환권 우리 또 사연 보내주신 분들 사연 소개될 분들께는요 저희가 치킨 상품권 보내드리도록 할게요 김신혜님의 신청곡 보아 only one
AD,6368.76,6464.66,95.9,3,1,SPEAKER_10,어색하게 마주 앉아 사소한 얘기로 안부를 묻고 가끔 대화가 끊기는 순간에는 차가운 정적 우릴 얼게 만드는 눈치 보는 네 모습 싫어 너무 다른 시선으로
