block_type,start,end,duration,segments,speaker_count,speakers,text
DJ/GUEST,2415.03,2427.19,12.16,3,2,"SPEAKER_04,SPEAKER_05",이거 완전 KBS 라디오 국장님 아니셔요? 라디오를 고정을 해놨습니다. 우리 이은지 씨가 워낙 진행을 활발하게 잘하시니까 듣기 좋습니다.
DJ/GUEST,2427.31,2442.88,15.57,4,2,"SPEAKER_04,SPEAKER_05",국장님 감사합니다. KBS 국장님이라고 제가 이제부터 8391님을 말씀드릴게요. 아니 근데 노래는 어떻게 싸이의 챔피언을 이렇게 좋아하셔요? 우울하니까 신나는 곡이 필요해서
DJ/GUEST,2443.8,2460.54,16.74,3,2,"SPEAKER_04,SPEAKER_05",확실히 12시부터 2시까지는 신나는 곡이 나와야 좋겠어요. 커피 3잔 주문하셨는데 누구 누구 드리게요? 거기 점검하는 저하고 같이 일하시는 분 두 분.
DJ/GUEST,2461.82,2479.84,18.02,4,2,"SPEAKER_04,SPEAKER_05",그렇게 해서 총 세 분 보내드려야 되고. 아니 우리 라디오에 어쨌든 사연이 당첨이 됐으니까 하고 싶은 이야기 있으세요? 가족들한테 해도 좋고요. 근데 하고 싶었는데 우리 이은재 씨의 악동복수에 들어오면 기분이 많이 좋아집니다.
DJ/GUEST,2480.36,2496.91,16.55,7,2,"SPEAKER_04,SPEAKER_05",아니 그러면 이거 어때요? 조정식 씨랑 박명수 씨 우리 주연민 선배님 그리고 은가인 씨한테 한번 음성편지 한번 남겨보시죠. 나나까지. 누구 누구? 나나. 나나. 나 저기 콩.
DJ/GUEST,2496.93,2511.23,14.3,8,2,"SPEAKER_04,SPEAKER_05",검은콩. 아 이본씨까지. 이본씨까지 듣다가 중간에 못 듣는데 시간이 안 돼서. 나머지는 추리로 봅니다. 나머지는 뭘로 보신다고요? 라디오로 그냥 계속 들어요. 계속 들어요. 이동하는 중이에요.
DJ/GUEST,2511.29,2542.76,31.47,7,2,"SPEAKER_04,SPEAKER_05",우리 함께하는 DJ들에게 음성편지 남겨봅니다. 국장님 가시죠. 예. 하여튼 뭐 저기 이은지 씨도 활발하고 막 좀 진행이 좋고 조정식 씨는 아주 책이 넘치고 박명수 씨는 그 육개암으로 뭐 나름대로의 그 철학이 있으니까 잘 진행이 되는 것 같아요. 박자들이. 그러니까 구간 구간 구간 지루하질 않아요. 저기 끝나면 또 색다른 DJ가 가고 그 다음 또 색다른 DJ가 가니까 아주
DJ/GUEST,2543.55,2558.25,14.7,2,2,"SPEAKER_04,SPEAKER_05",재미있게 듣고 있습니다 아이고 감사합니다 국장님 국장님이라는 호칭이 좀 익숙하세요 국장은 전화 통신 쪽에서 국장이라고 하는데.
DJ/GUEST,2558.27,2575.55,17.28,7,2,"SPEAKER_04,SPEAKER_05",실제로 국장님이시구나. 제가 DJ들한테 이거 다 전파할게요. 이런 청취자분이 계셨다고요. 특색이 있어서 좋다고 듣기도. 감사합니다. 코너코너도 니트가 있고 괜찮아요. 싫어하지 않게끔.
DJ/GUEST,2575.53,2613.31,37.78,2,2,"SPEAKER_04,SPEAKER_05",너무 감사드리고 이 감상평 제가 모든 이본씨 박명숙씨 조정식씨 우리 은가은씨 주현미선배님께 제가 다 전달하도록 하겠습니다 그래서 제가 이은지씨를 이은지씨가 개그적이네 고맙습니다 국장님.
DJ,2618.54,2713.86,95.32,15,1,SPEAKER_04,어 말투가 완전 우리 아빠 말투 이보라 언니 우리 충청도 아버님 너무 귀여우셔요. 너무 귀여우셔요. 너무 사랑스럽고요. 성진모님 어르신 진짜 밥 먹다가 큰 웃음 주셔서 감사. 아유 맞아요. 그러니까요. 이영은님 저희 충청도 충주 출신 아빠가 생각이 납니다. 영은님 우리는 오늘부터 8391님을 라디오 국장님으로 모시기로 했어요. 딱 이 부분만 잘라가지고 우리 나중에 스팟 같은 거에 나가도 너무 좋지 않아요 우리 또 여태까지 함께하는 우리 DJ들에게 특히나 명수 선배에 대한 사랑이 어마어마하신 것 같아요 명수 선배의 라디오의 감상평을 위트가 있고 철학이 있다 그만의 철학이 있다 라는 또 이야기 주셨습니다 이소라님 말투가 너무 따수워요 덕분에 힐링이에요 충청도 국장님 주선희님 아 언니 어르신들이랑 쿵짝이 맞는 거 너무 웃겨 나는 전화 연결할 때마다 어르신분들이랑도 쿵짝이 맞지만 우리 예전에 한번 어린이 친구랑 전화 연결했는데 제가 야 학교 가기 싫지 않냐고 이랬던 적 있잖아요 그걸 지금도 생각하면서 또 웃는다니까요 아 진짜 빵 터졌습니다 윤상훈님 듣는 사람 기분 좋게 만들어주는 목소리 국장님. 오늘부터 8391님을 국장님으로 모시기로 우리 청취자분들 함께 박수로 환영해 주십시오. 아시겠죠? 8391님의 신청곡입니다.
AD,2714.43,2871.55,157.12,6,2,"SPEAKER_07,SPEAKER_13",싸이의 챔피언 진정 즐길 줄 아는 여러분이 이 나라의 챔피언입니다. 파도의 축제 서로 평가를 의지 않는 것이 숙제 소리 못 질르는 사람 오늘 술래 따가지 빙글빙글 강강술래 술래 함성이 터져 메아리 퍼져 파도 타고 모두에게 퍼져 커져 아름다운 젊음이 갈라져 있던 닭덩어리 자막 제공 배달의민족 전경과 흑색 서로 대립했었지만 나인 같애 고로 열광하고 싶은 마음 같애 오늘부로 힘을 모아 합세 하나로 합체 모두 힘을 길러 젊음을 질러 자유로운 외침이 저기 높은 하늘 찔러 자막 제공 배달의민족 크게 뛰어 올라 더 높게 내일 걱정은 내일모레 모두 눈 비춰보게 둥글게 둥글게 돌고 도는 몰래 바다 인생 한방인데 바람 따라 구름 따라 선벽을 치면서 노래를 하면서 주먹을 쫙 들고 하늘로
DJ,2901.92,3064.97,163.05,25,1,SPEAKER_04,싸이 챔피언 듣고 왔습니다. 여러분은 이은지의 가요광장 함께하고 계시고요. 저는 텐디 이은지입니다. 커피 주문해 주신 분들 사연 만나볼게요. 1128님 임산부 친구와 호캉스 가고 있습니다. 저도 7개월 아기를 남편에게 맡기고 나왔어요. 자유부인들을 위해 커피 두 잔 부탁해요. 아니 이게 사실 태교 여행 뭐 그런 게 있더라고요 이게 사실 아기를 낳고 또 육아하고 키우고 하다 보면 오히려 놀 시간이 없어서 미리미리 여행 가는 거다 해가지고 태교 여행 같은 그런 또 이벤트를 많이 많이 하시더라고요 1128님 오늘 아주 해피한 시간 보내셨으면 좋겠고 밖에가 날이 추워서 오히려 호캉스 같은 느낌이 또 찰떡으로 잘 맞을 것 같네요 5033님 안녕하세요 딸기농부입니다 경남에서 딸기 농사하고 있습니다 온실 안은 무척 덥네요 커피가 땡겨요 여기서 젊은 농부 5명이서 농사하고 있어요 커피 5잔 부탁드려요 옛날에 텐디 또 그 밭일 하시는 분들 뭐 이렇게 농사하시는 분들 농작물을 키워내고 또 하시는 분들이랑 문자가 많이 왔었어요. 예전에 버섯 농장 하시는 분 그리고 양봉 하시는 분이랑도 전화 연결한 적이 있고요. 뭐 딸기도 한 분 있었던 것 같아요. 귤 귤 하시는 분들도 있었고 이 농부분들이 또 이은지의 가요광장 많이 많이 들어주시더라고요. 사연 감사드리고 오늘도 완전 파이팅입니다. 2448님 은지언니 냉장고에 두고 깜빡한 냉이 손질하면서 듣고 있습니다. 후다 끄내고 커피 한잔하고 싶어요. 냉이 비빔밥도 맛있겠다. 냉이 비빔밥 뭔가 이런 나물 비빔밥도 좋고요. 아니면 된장국 같은데 위에다가 여러분 냉이를 그냥 이렇게 촤르르 올리면 너무 맛있잖아요 아우 기가 막히다 기가 막혀 2448님 점심 맛있게 드시고요 0427님 저는 스마트폰 강사인데요 매번 차량 이동 중으로 신청을 못했는데 오늘은 시간 여유가 있어 처음 커피 한 잔 살짝 신청해 봅니다 오늘은 오후 교육시간이 3시라 가는 동안 커피 한 잔 마시고 싶어요 부탁드려요 아마 어르신분들께 스마트폰을 알려주는 그런 강사일 하시는 것 같고요. 아무래도 했던 이야기를 좀 자주자주 반복해야 되지 않을까. 그게 사실 쉬운 일은 아니거든요. 047님 오늘도 화이팅이고 저희가 커피 한잔 보내드릴게요. 우리 잠깐 광고 듣고 다시 올게요.
AD,3077.19,3190.47,113.28,11,7,"SPEAKER_07,SPEAKER_10,SPEAKER_11,SPEAKER_12,SPEAKER_13,SPEAKER_17,SPEAKER_24",고맙습니다. 고맙습니다. 동공기관 우선구매 대상기업 보료기프트 성인용 기저귀 금비금비 얼쑤 한국에서 만들었네 성인용 기저귀 금비금비 얼쑤 국내 생산 성인용 기저귀 금비 검색창에 금비기저귀를 검색해보세요 국산 성인용 기저귀 금비 최고의 플레이는 최고의 수면에서 베스트 슬립 대표 서진원입니다. 대한민국 축구 국가대표팀의 수면 이제 베스트 슬립이 책임집니다. 우리 선수들이 최고의 플레이를 할 수 있도록 최고의 수면을 선물합니다. 대한민국 축구 국가대표팀 공식 침대 매트리스 베스트 슬립 스마트 AI 가디언스 기술로 완성한 프리미엄 블랙박스의 새로운 기준 AI 블랙박스의 빈틈을 채우다 지속 가능한 미래를 위해 조용히 발걸음을 내딛는 곳이 있습니다 GH경기주택도시공사는 기후위기에 대응하고 탄소중립을 실천하며 친환경과 녹색성장의 가치를 공간에 더합니다. 미래를 위한 공간. GH경기주택도시공사가 함께합니다.
DJ/GUEST,3195.34,3292.51,97.17,9,2,"SPEAKER_04,SPEAKER_09",매일 똑같은 하루 그런 생각은 잠시 접어도 2026년 1.4분기 청주 3화지 가요광장 받아쓰기 다음은 이은지가 가요광장에서 자주 하는 말 중에 하나입니다 잘 듣고 문자로 받아써서 보내주세요 사랑 없인 안 못살아 대추나무 사랑 걸렸네 잘 들으셨나요? 한 번 더 들려드릴게요. 리슨 앤 리핏 사랑 없이 난 못 살아 대추나무 사랑 걸렸네 보내주실 번호 샷8910 짧은 문자 50원 긴 문자와 사진 문자 100원 어플 콩과 KBS 플러스는 무료입니다. 미션에 성공하신 분들 중 총 26분께 선물 보내드립니다. 무엇을? 우유 생크림 딸기 케이크 4개로! 여러분 바다쓰기 미션 많이 많이 참여해주시고요 2부 끝곡입니다 박효신 기프트 들려드리면서 우리는 1시에 다시 만나요 누가 뭐라도 나는 약하지 않다고 눈물로 참 떠날 때
GUEST,3296.68,3417.47,120.79,5,1,SPEAKER_09,모르고 나를 말하는 얘기도 하나 둘 셋 별을 세다가 아침이 온 순간에 눈을 감아 또다시 눈을 뜰 때면 It's gonna be alright 텅 빈 내 맘을 어떻게 채워야 할지 알 수가 없던 날들 내 눈에 보이던 세상이 전부라는 걸 모두 거짓이었어 얼마나 더 가야 하는지 여기가 또 어디쯤인지 고개를 든 순간에 오늘의 하늘을 내게 누군가가 두고 갈 선물 같아 어제보다 더 다
AD,3438.75,3618.89,180.14,33,8,"SPEAKER_00,SPEAKER_03,SPEAKER_10,SPEAKER_15,SPEAKER_16,SPEAKER_17,SPEAKER_19,SPEAKER_25","KBS 스크래프 M 57분 교통정보입니다. 오늘 출근길 다소 혼란스러웠습니다. 서울시내버스가 파업에 들어가면서 버스 운행이 전면 중단됐는데요. 도로에 차가 증가하면서 출근 정체 풀리는 속도도 더뎠습니다. 오후에 접어들면서 소통은 좋아졌는데요. 다만 퇴근길에도 교통 혼잡이 우려됩니다. 서울시에서는 지하철 막차 시간을 종착역 기준 익일 새벽 2시까지 연장했고요. 자체구에서는 지하철 간 무료 셔틀버스를 운행하고 있습니다. 도로 이용에 참고하시기 바랍니다. 동부간선로 성수분기점 방향 성동분기점 지나 1차로에는 추돌사고 나서 일대 정체로 이어집니다. 이어서 서해안고속도로 서울쪽으로는 서서울요금소에 화물차가 고장으로 서있는데요. 1차로 통행 어렵습니다. 경부고속도로 부산방향 오삼보건에 발생한 사고처리가 계속되면서 일대 정체로 이어지고 있고요. 이후 남사진위에서 속도 주춤합니다. KBS 크레프M 57분 교통정보 서후영입니다. 오빠 주말에 아울렛 갈까? 주말엔 차 막힌단 말이오 지하철 타고 가면 되는데 그렇게 가까운 데가 있단 말이오? 유명 브랜드 모두 모여있는 그곳 합리적 가격의 시마리오란 말이오 가산 디지털 단지 마리오 아울렛역에서 만나는 마리오 아울렛 살면서 제가 2시를 기다려본 적이 없는데 하디 덕분에 그래도 매일매일 힘을 얻는 것 같습니다. 하디 이제 곧 52시니까. 2시가 기다려지는 라디오. 안녕하세요 여러분. 항상 유쾌한 텐션으로 하루를 밝혀준 우리 하하. 유쾌한 텐션으로 하루를 밝히는 라디오. 슈퍼라디오 이제부터 더 잘하고 아빠가 영원하면 좋겠어요. 청취자 여러분과 영원히 함께하고 싶은 라디오 KBS 쿨 FM 하하의 슈퍼라디오와 함께해주세요. 1단계, 2단계, KBS가 업그레이드합니다. KBS 플러스, KBS만이 제공 가능한 무료 서비스. 스마트폰에서 즐겨보세요. 40회 실시간 채널, 5만 개의 다시 보기. KBS의 과거, 현재 프로그램을 소환해서 볼 수 있습니다. 지금 당장 구글 플레이 애플 스토어에서 KBS 플러스를 다운받으세요."
DJ/GUEST,3625.14,3739.39,114.25,16,2,"SPEAKER_04,SPEAKER_09","이은지의 가요광장 KBS 라디오 이은지의 가요광장 3부 시작했고요. 저는 DJ 이은지입니다. 2부 끝에 가요광장 받아쓰기 진행했는데요. 평소에 텐디가 자주 하는 말이죠. 사랑사랑 누가 말했나 내가 말했지. 사랑없이 난 못살아 대추나무 사랑 걸렸네. 중에서. 취자취자 청취자 김이야님 사랑없이 난 못살아 대충 너무 사랑 걸렸네 방학이라 가요강장 잘 듣고 있어요 재밌어요 아 감사드립니다 이 사랑, 사랑없이 난 못살아가 어떤 연인과의 사랑을 텐데는 이야기하는 것은 아니고요 그냥 인류애가 느껴질 때 너무 좋아요 뭐 요즘 뭐 많은 짤들 있잖아요 편의점에 어떤 분이 이렇게 식사를 하러 오셨는데 의자가 없었어요 그래서 우리 편의점 사장님이 의자를 싹 갖다 주면서 여기서 편하게 드세요 그 정도의 사랑을 보여주었더니 그 식사하신 분이 알고 봤더니 굴삭기 기사님이어서 그 편의점 앞에 있는 눈을 굴삭기로 싹 치워주는 그 짤을 보고 아 역시 사랑 없인 난 못살아 대추 너무 사랑 걸렸네 이렇게 이야기를 했답니다. 7699님 은지님 12시가 맘마타임이라 항상 아기 이유식 먹이면서 잘 듣고 있어요. 신상아 때부터 은지님 목소리 들었는데 이제 돌이 돼요. 전 돌끝맘이 되었네요. 사랑 없이 나무 써라 대추나무 사랑 걸렸네. 아 우리 멋진 아드님 사진도 보내주셨습니다."
DJ/GUEST,3739.41,3907.14,167.73,19,2,"SPEAKER_04,SPEAKER_09",이야 너무 잘생겼는데요 아드님 1살 돌사진 돌상 위에서 찍은 사진 보내줬어요 이렇게 우리 아들 멋지게 한복입고 왕자님처럼 덕하고 앉아있는 사진 보내주셨는데 너무 귀여워 너무 귀여워 사진 너무너무 감사드리고요 7699님 돌끝맘 이어서 기분이 좋으신 것 같은데 이제부터 시작이랍니다. 정말 많은 청취자분들이 이야기 해주시거든요. 돌끝맘 잠시 즐기시고 이제부터 걸어다니기 시작하고 뛰어다니기 시작하면 보통일 아니래요. 육아하시는 내내 오래오래 이은지의 가요광장 들어주시면 너무너무 감사할 것 같습니다 두 분 포함해서 총 26분께 우유 생크림 딸기 케이크 보내드릴게요 당첨자 방송 후에 이은지의 가요광장 홈페이지 공지사항에서 확인해 주셔요 취자들 오늘은요 광장마켓 다이소 준비해놨고요 오늘 주제에 대한 힌트 음성으로 준비되어 있다고 합니다 한번 들어봅니다 일단 혈당 조절에 효과적입니다 왜? 혈당 스파이크 증상 중 하나가 식곤증인데 이 시간에 라디오 듣다 보면 싹 날아가고요 혈액순환도 원활해집니다 DJ 텐션 따라서 웃고 흔들어 제끼다 보면 몸에 피가 싹 도는 느낌이 들어요 여기까지 텐디가요 가요광장의 효능에 대해서 언급했던 부분인데요. 많이 언급했어요. 콜라겐이 나온다. 피부가 좋아진다. 노화에 방지가 된다. 탈모 예방이 된다. 등등등등 텐디가요 가요광장 효능에 대해서 이야기 많이 드렸는데 과연 어떤 주제로 무슨 이야기를 나눌까 조금 있다가 확인해 주세요. 이번 주 광고 소개 게스트 맞춤 송 천일동안 함께해준 청취자분들을 위한 이승환씨의 천일동안 음악 주세요 그 천일동안 알고 있었나요 정오되면 바블로프의 계절은 항상 취자들의 텐션을 위해 최선 다해왔던 나를
AD,3908.99,4056.51,147.52,16,5,"SPEAKER_10,SPEAKER_14,SPEAKER_17,SPEAKER_20,SPEAKER_22","뭐야 뭐야 요즘 피부 비결 뭐야? 세수하고 한 장 쓱 닦고 착 화장 전에 한 장 쓱 닦고 착 쓱 닦고 착 붙이는 메디힐 토너 패드 2024, 2025 올리브영 아워즈 토너 패드 1위 피부 고민 있을 땐 메디힐 토너 패드 글로벌 더마 코스메틱 메디힐 우리의 물을 나누면 더 행복한 오늘이 있고 우리의 기술을 나누면 내일이 더 기대됩니다 다 좋아해요 미라로 행복으로 K-WATER로 이 캠페인은 기후위기 대응을 선도하는 글로벌 물기업 K-WATER 한국수자원공사와 함께합니다. K-WATER로 안녕하세요. 장나라입니다. 살다 보면 갑작스러운 사고나 질병으로 위기에 빠지는 경우가 있습니다. 신안은 사회복지사, 경찰관과 협력해 어려움을 겪는 가정이 일상으로 돌아올 수 있도록 위기가정지원사업을 펼치고 있습니다. 위기의 순간, 신안과 함께. 위채로 소화부 아 이 라디오 광고가 보이는 라디오 광고면 어땠을까요? 스타리아 라운지의 넓은 공간을 담기에 말로는 부족하니까 가족 모두가 편안한 여유로운 공간과 새로워진 편의 사양. 가까운 전시장에서 확인해보세요. 더 뉴스 스타리아 라운지 출시. 땅쓰 땅쓰 땅쓰 땅쓰 땅쓰 부대찌개 참 맛있어요 땅쓰 부대찌개 누구나 쉽고 빠르게 땅쓰 부대찌개 맛있게 끓여요 포장 전문 배달 가능 땅쓰 부대찌개 이 땅 위에 부대찌개 땅쓰 부대찌개 보배 보배 보배 보배 보배 반점 우리 동네 단불 중식 보배"
DJ/GUEST,4064.51,4335.64,271.13,35,2,"SPEAKER_04,SPEAKER_09","고맙습니다. 없는 거 빼고 있을 거 다 있습니다. 광장마켓 다 있어. 취자들 이번 주 토요일 1월 17일이 제가 DJ를 맡은 지 딱 천일이 되는 날이거든요. 그래서 준비한 주제 가요광장이 천일 동안 당신에게 미친 영향 좋아야 될 텐데 좋은 영향이 가야 할 터인데 과연 좋은 영향이 갔을까요? 제가 늘 말씀드리는 가요광장의 효능, 효과 뭐 이런 것들 많이 이야기했잖아요. 진짜 찐으로 여러분에게 미친 영향이 좀 궁금해요. 뭐가 있을까? 예를 들어 가요광장을 같이 들으며 친해진 친구가 있어요. 남편이랑 같이 듣는데요. 와이프랑 같이 듣는데요. 등등등. 말투가 이상하게 텐디랑 닮아졌어요. 뭐 이런 것들 있잖아요. 텐디가 많이 하는 말이 뭐가 있죠? 아르르르르하! 이런 추임새나 그런 것들을 좀 했을 수도 있겠다라는 생각이 들고 DJ를 닮아 시도 때도 없이 노래를 불러 제끼고 싶다든지 아 너무 좋지 아니 혹시라도 노래 부르고 싶은 청취자분들이 있으면 전화 연결해가지고 한바탕 그냥 한 소절 들어보는 것도 좋아요 텐디처럼 이렇게 개사하는 거 좋아하시는 분들이 있을 수도 있고요 가광 들으면서 운동했더니 살이 빠졌다. 그리고 우리 가광 초대석에 나왔던 어떤 게스트분들 사랑에 빠졌다 하실 수도 있잖아요. 왜냐하면 다양한 게스트분들이 나와주시기 때문에 우리 진짜 많은 게스트분들 나오시잖아요. 아이돌뿐만이 아니오라 배우분들. 우리 또 얼마 전에 우리 저기 상 받은 이재씨 아 케데온의 또 케이팝 데모난터스의 또 작곡가 가수 이재씨도 나와줬었고 박천휴 작가님도 놀러주셨고요 토니상 상 받으신 박천휴 작가님도 놀러주셨고 아이돌뿐만이 아니라 어떤 이런 수많은 게스트분들께 입덕하신 계기 뭐 그런게 있으시면 또 텐디한테 또 문자사연 보내주시고요 가요광장을 함께하며 생긴 여러분의 변화, 변동, 움직임, 전환, 기복 많이 많이 보내주세요. 문자 번호 샷8910 짧은 문자 50원 긴 문자와 사진 문자 100원 인터넷 콩과 KBS 플러스는 무료고요. 듣고 싶은 신청곡이 있다면 노래 제목을 같이 써서 보내주십시오. 사연이 궁금해 아우 텐지 난 모르겠어요 나 그냥 노래 하나 하고 싶은데요 하시면요 전화라고 문자 주실래요 그러면 저희가 전화를 걸면 02로 전화를 하겠습니다 그리고 혹시나 아니야 난 전화는 좀 그래 아직은 텐지랑 조금 더 친해지는 중 하시는 분들은 전화 4절 이렇게 또 적어주시면 안 걸어요 해치지 않아요 깨물지 않고요 취자들을 사랑으로 보듬어 드리겠습니다 오늘 광장마켓 선물 청조사 기간답게 정말 빵빵하네요 소개된 이 사연이 소개된 모든 분들께는 일단 저희가 치킨 상품권을 보내드릴 거고요 이 중에 딱 세 분만 추첨해서 저희가 선물로 100만원 상당의 음식물 분쇄 처리기 교환권 리얼리 완전 널 좋아해. 100만원 상당의 음식물 분쇄 처리기 교환권을 보내드릴 거래요. 대박 사건이니까. 여러분 정말 디테일한 정말 다양한 사연들 텐데 기다리고 있겠습니다. 아시겠죠? 우리 청취자분들께 가요광장에 미친 영향에 대해서 사연을 기다리면서 노래부터 듣고 옵니다. 이석훈 그대를 사랑하는 10가지 이유."
