block_type,start,end,duration,segments,speaker_count,speakers,text
DJ/GUEST,6347.68,6379.65,31.97,7,2,"SPEAKER_03,SPEAKER_10",잠깐만 근데 제목이 잠깐만 제목이 아는데 후이의 제 노래 아니고요 지코의 Yes or No Yes or No Yes or No 아니에요? 맞는 거 아니야 이거? 말이 안 들어가잖아요. 제목에 말이 들어간다고 했죠. 기회는 소정에게 가버립니다.
DJ/GUEST,6380.23,6395.19,14.96,4,2,"SPEAKER_09,SPEAKER_10",근데 그 가수가 맞아요? 가수가 다른가 봐요. 소정에게 3초의 기회 드리겠습니다. 3 2 1 공평하게 공평하게 기회는 모두의 음악을 한 번만 더 듣겠습니다.
DJ/GUEST,6395.21,6416.17,20.96,18,2,"SPEAKER_03,SPEAKER_10",음악 주세요. 후이! 해볼게요! 지코의... 지코가 아닌가요? 아아! 다시 다시! 진짜 죄송해요! 다시 할게요! 어? 이 노래 뭐야? 아 잠깐만! 멘붕! 왜 그래요? 귀신 봤어요? 왜 그래요? 무섭게! 아니 잠깐만! 말해 YES or NO 아니에요?
DJ/GUEST,6416.19,6445.74,29.55,8,3,"SPEAKER_06,SPEAKER_09,SPEAKER_10",자 그래서 어떻게 할 겁니까? 누가 부르셨죠 근데? 서정! 지코 선배님의 말해 YES or NO 아니 야! 정답을 제발! 정답 제발! 왜 정답을 말하지않고 계속 누구꺼죠? 왜 그렇게 하는거에요?
DJ/GUEST,6445.76,6499.7,53.94,6,3,"SPEAKER_03,SPEAKER_09,SPEAKER_10",아니 이게 제가 힙합프로그램에서 이 노래 본거같은데 아 그래요? 힙합프로그램에서 나온 노래가 오늘의 생일 축하드립니다 이소정씨 축하드립니다 2026년에 첫 대결 아우 저 너무 웃겨가지고 지금 살짝 어지러워요 목뒤가 뜨거워요 스톤헤드님 돌머리란 뜻인가봐요 스톤헤드씨가 저기요 수박씨 그냥 박수나 치세요 이선희씨 서로 줍줍 1대1이다 억울해하지 말아라 맞아요 서로 하나씩 있어요 왜냐하면 이거는 결정적인 점수인데 굉장히 충격적인 저도 왜 말을 안하지 왜 말로 안하지 마르 예쏠 노 제발 마르 예쏠 노 하고 있었어요. 약간 불안하셨나보다. 가수가 불안했군요.
DJ/GUEST,6500.7,6530.99,30.29,5,2,"SPEAKER_03,SPEAKER_10",분명히 힙합 프로그램에서 나온 것 같은데 거기에 가수가 있나? 다행이다. 지코 선배님은 심사위원으로 나가시니까 이해했어요. 이게 뭔가 힙합의 크루 프로미션 그래서 석허도 자이언트 이렇게 해야 되는 줄 알았군요 그래서 뭐지 이렇게 된 것 같아요 음원 사이트에 지아코 말해 예스 올 노라고 뜹니다 말해 예스 올 노라고 감사합니다 축하드리고요 감사합니다 후이 씨 마음이 좀 괜찮아요?
DJ/GUEST,6531.54,6556.07,24.53,2,2,"SPEAKER_03,SPEAKER_10",오늘은 쉽지 않은데요 오늘 조금 더 우울하죠 저는 조금 더 행복해요 다음주 또 행복하기를 후이씨에게 저희가 응원 보내드리면서 소정씨 추천곡 띄워드립니다 김광석 사랑했지만 두 분 오늘 고맙습니다 감사합니다
DJ/GUEST,6560.03,6877.86,317.83,19,2,"SPEAKER_06,SPEAKER_10","어제는 하루 종일 비가 내렸어 자욱하게 내려앉은 먼지 사이로 귓가에 은은하게 울려 퍼지는 그대는 선빛 속으로 사라져버려 때론 눈물도 흐르겠지 때론 가슴도 저리겠지 외로움으로 사랑했지만 그대를 사랑했지만 그저 이렇게 멀리서 다가설 수 없어 지친 그대 곁에 머물고 싶지만 떠날 수밖에 그대를 사랑해 때론 눈물도 흐르겠지 그리움으로 때론 가슴도 저리겠지 외로워 이은지의 가을 광장에서 준비한 1월 선물입니다. 건강하고 편한 더마름 다이어트에서 가인미가 신마름 뷰티 상품권 고고론에서 애슐런 스테어 클라이머 발갈이 박준영의 싱크퓨어에서 음식물 분쇄 처리기 급발진 잡넷 지넷에서 한문철 블랙박스 에브리바디 엑센코리아에서 디스플레이 블루투스 이어폰 클림트 어워드 수상작가 주니 퀸 갤러리에서 디지털 아트 작품 아름다운 비주얼 아비쥬 뷰티에서 뷰티 상품권 메디컬 스킨케어 브랜드 DMS에서 코르테 화장품 세트 바찌 화장품에서 어성초 샴푸, 선크림, 알로에 젤 시선이 머무는 아름다운 뷰브이 코스메틱에서 온라인 상품권 HPNC에서 엔자인 워싱 파우더와 링클 앰플 패드 화장품 직접 재배 병풀 사용 톤28에서 시카 새벽크림 교환권 2025 에이펙 공식 후원 리포브에서 화장품 세트 레몬과 허브의 조화 파마블랜드에서 유기농 레몬즙 스틱 나를 위한 온전한 휴식 리노바 화장품에서 페이스 앤 넥 듀오 마스크팩 댕댕이 간식 전문 닥터 그레인팝에서 휴먼 그레이드 유기농 간식 세트 방송 PPL 플랫폼 비전기획에서 메르베 주얼리 대한민국 양념치킨 초갓집에서 치킨 상품권 스마일 에브리데이 프레밍트에서 프리미엄 덴탈 케어 세트 클라클라 제클라 스포츠 브랜드 제클라에서 라이크라 볼캡 속편한 하루를 위한 두 알 스톰에서 프리미엄 식이섬유 정 독일 기술 정점 브랜앤스툴에서 슈퍼솔리드 고용량 멀티탭을 드립니다. 취자들 새해에도 가요광장 곶간 가득 채워놨어요. 2026년도 가요광장과 꼭 함께해 주시고요. 새해 복 많이 받으세요. 이은지의 가요광장 오늘은 여기까지. 내일은요. 2026년의 첫 토요일이죠. 펑키스로데이 준비해놨습니다. 기대 많이 해주시고 오늘의 끝곡 펜타곤 빛나리 들려드리면서 여러분 내일도 비타민 충전하러 오셔요."
AD,6879.29,6879.35,0.06,1,0,,안녕.
GUEST,6886.08,7037.4,151.32,6,1,SPEAKER_06,"나는 뭐랄까 아주 오래전부터 너를 좋아했었다고 늘 지금 말한다면 뭐가 달라질까 달라질 게 없는 맘을 가진 너는 마치 뿌리 깊은 나무 같아서 신이 곱게 빚은 한 송이의 Flower 사라지지 마 달라지지 마 내가 너를 좋아해도 Nobody knows 다른 여자를 봐도 Nobody's like you 용기가 없어서 I'm sorry 더 맘껏 비웃어 그래 난 내 사랑 앞에서는 늘 찌질이 나는 뭐랄까 아직도 많이 좋아할 것 같아 왜 대체 말을 못할까 기죽은 어린애 같다 다른 사람 만나지 마 내 가슴 무너지게 그러지 마요 빈뜸 없는 그대에게 난 무리일까요 텅 빈 맘은 공터인데 머릿속은 터지네 Oh 맘 언제 이렇게 돼버렸나요 내가 너를 좋아해도 Nobody knows 다른 여자를 봐도 Nobody's like you 용기가 없어서 I'm sorry 저 맘껏 비었어 그래 나는 널 사랑해 감사합니다. 난 사랑 앞에선 늘 찢으리 네가 나의 주복이 돼 보고만 있어도 힘이 나네 이 하늘에 빛이 나네 내 맘이 너에게 닿기를 바래 말하지 않아도 no no no 언제나 내 맘은 no no no 아름다운 그대와 걸어가고 싶어 Everybody knows 한 가지 말할 게 있어 I'm to my heart 난 네 앞에서만 떨려 그래 Love you, love you, love you Like you, like you, like you 너를 사랑해"
AD,7041.07,7159.9,118.83,8,3,"SPEAKER_04,SPEAKER_07,SPEAKER_15",기상캐스터 배혜지 서울시내 강변북로 일산 쪽으로 원효대교 부근 3차로에서는 고장난 차를 처리하고 있어서 부근으로 차량들 서행합니다. 평택 제천고속도로 제천 방면 북진천 부근에서는 3시간 전쯤 탱크로리 차량에서 가스가 누출되는 사고가 있었는데요. 이 때문에 현재 제천 방면으로 남한성 나들목부터 북진천 나들목 사이가 전면 통제되고 있는 만큼 미리 다른 길로 우회하셔야겠습니다. 그 밖의 청주 영덕고속도로 청주 쪽으로 회인 기상캐스터 배혜지 모든 인쇄 가능한 성원에드피아 온라인 주문 간편한 성원에드피아 누구든지 어디서나 쉽고 빠르게 인쇄의 유토피아 성원에드피아 디지털 인쇄도 역시 성원에드피아 국민 인쇄 성원에드피아 코입술 주름 개선을 위해 피부 깊은 곳부터 자연스럽게 PLLA로 부드럽게 채우다 올리비아 저희 라디오는 어떤 매력이 있을까요?
GUEST,7159.92,7169.19,9.27,1,1,SPEAKER_08,라디오는 생각보다 말씀하시는 게 좀 침착하시고 조언하시는 것도 되게 진솔하시고 현실적이어서 듣기 좀 편안하고 또 재밌기도 하더라고요.
AD,7169.25,7214.99,45.74,13,3,"SPEAKER_13,SPEAKER_14,SPEAKER_15","감사드리겠습니다. 굉장히 저희가 추구하고 있는 바와 똑같은 말씀을 해주셨어요. 침착하고 진솔하고 듣기 편안하고 재밌기도 한 DJ 박명수. 매일 오전 11시 여러분들과 함께합니다. 박명수의 라디오쇼. 2시간 했으면 좋겠어요. 안 돼요. 왜요? 1단계, 2단계, KBS가 업그레이드합니다. KBS 플러스, KBS만이 제공 가능한 무료 서비스. 스마트폰에서 즐겨보세요. 40회 실시간 채널, 음원계의 다시 보기. KBS의 과거, 현재 프로그램을 소환해서 볼 수 있습니다."
