block_type,start,end,duration,segments,speaker_count,speakers,text
GUEST,4321.41,4384.94,63.53,8,2,"SPEAKER_03,SPEAKER_09",새해 첫날이었던 어제 여러분은 어떤 노래를 첫 번째로 들으셨나요? 새해 처음으로 듣는 노래가 한 해의 운세를 좌우한다는 속설 한 번쯤은 들어보셨을 것 같은데요. 그래서 오늘은 이런 주제로 얘기해볼까 합니다 바로 2026년 나의 새해 첫 곡 첫 소절부터 자신감과 기세가 풀 충전되는 케이팝 들으면 럭키가이가 될 것 같은 발랄한 댄스곡 따뜻한 한 해를 보내게 해줄 훈훈한 감성 발라드 등등 여러분들이 새해 첫 곡으로 들었거나 추천하고 싶은 노래를 사연과 함께 써서 보내주세요 저희가 최선을 다해서 한 소절씩 불러드리겠습니다 보내주실 번호 문자번호 샵 8910 짧은 문자 50원 긴 문자와 사진 문자는 100원 인터넷콘과 KBS 플러스는 무료입니다. 사연 소개되신 분들께는 추첨을 통해 편의점 상품권 선물로 드릴게요. 저희 구삼지의 목소리로 듣고 싶은 새해 첫 곡 많이 많이 보내주세요. 어제가 새해 첫날이었는데 우리 또 요리왕 이수정씨는 어떻게 떡국을 드셨나요? 제가 하고 싶었는데 부모님을 뵈러 가느라 어머니가 우족탕을 해놓으셨더라고요.
AD,4384.96,4385.02,0.06,1,0,,우족?
DJ/GUEST,4385.0,4389.27,4.27,4,2,"SPEAKER_09,SPEAKER_10",네. 이틀을 끓이셨대요. 너무 맛있게 먹고 왔습니다. 우족탕.
DJ/GUEST,4390.27,4418.41,28.14,4,2,"SPEAKER_09,SPEAKER_10",제가 아는 뭔가 꼬리곰탕 이런 거랑 다른 건가요? 근데 소의 발뼈로 이제 푹 고와가지고 만드는 건데 너무 맛있고. 어떤 느낌이에요 우족탕은요? 고기가 살코기보다는 콜라겐 부분 있잖아요 발쪽이다 보니까 도가니 같은 도가니들이 들어있는 부분인데 팍팍 넣고 먹고 왔어요 건강에 좋은 거는 기가 막히게 잘 챙겨 먹는 거죠
DJ/GUEST,4418.4,4443.93,25.53,3,2,"SPEAKER_03,SPEAKER_10",너무 좋아요 한방오리 이런거 너무 좋아요 한방백숙 소정씨 집에서 가시호가피 냄새 많이 나 능이백숙 능이버섯 차가버섯 그런거 굉장히 좋아해요 아니 후이씨는 상황이 어때요? 새해인데 잘 챙겨 먹었어요? 저는 어제 한 끼 먹었나요?
DJ/GUEST,4444.11,4497.07,52.96,4,2,"SPEAKER_03,SPEAKER_10",네가 뭘 먹었어 너무 말랐어요 그게 아니라 어제 제가 등산을 했는데 이제 와 이게 찾아봤는데 30분이면 올라간대요 되게 가벼운 마음으로 심지어 복장도 안 갖추고 그냥 적당한 복장으로 올라갔는데 너무 높은 거예요 생각보다 한 시간이 넘게 걸렸어요 그래서 갔다가 내려왔는데 내려와서 바로 맛있는 거 먹어야죠 근데 그 힘든 제가 예상치 못한 왜냐하면 저 30분인 줄 알고 초반에 뛰었거든요 심지어 아이고 근데 이제 호흡이 너무 많이 차가지고 내려오고 나니까 입맛이 없는 거예요 오히려 입맛이 없어 도토리묵 먹어야 되는데 도토리묵 오히려 너무 힘들어서 네 너무 힘들어서 그래가지고 밤늦게 그냥 한 끼 제대로 먹고 아 아쉬운데 도토리묵 드시러 꼭 가세요 다시 다시 우리 셋이 한번 가자 근데 저는 궁금한 게 등산에 도토리묵이 어떤 조합이에요?
DJ/GUEST,4497.05,4638.8,141.75,5,3,"SPEAKER_06,SPEAKER_09,SPEAKER_10",밑에 파산하고 나면 도토리묵이랑 막걸리랑 파전 동동주 뭐 이런 거 배고프니까 소정씨 우리가 데리고 갈게 뭘 모르네 등산을 그것 때문에 가는 건데 제가 가는 데는 그런 게 없어가지고 음악부터 듣고 올 테니까 딱 기다리시고 지금 많은 분들이 신청해 주신 신청곡 장종윤씨 조영애씨 전혜연님이 신청해 주신 곡 우주소녀 이루리 여름엔 바람 따라 날아 올라 조금씩 물들어가 벅차올라 내가 바라는 걸 널 위한 말해줘 두 마음에서 너를 비춰 이루리다 봄 랏다 랏다 널 비우리다 내 맘에 약속해 이번 앨범은
DJ/GUEST,4717.23,4740.08,22.85,2,2,"SPEAKER_09,SPEAKER_10",우주소녀 이루리 듣고 왔습니다 오늘은요 광장코인 노래방 광코노 가요광장의 정말 귀엽고 깜찍하고 사랑스러운 명창들이죠 가수 이소정씨 그리고 후이씨와 함께하고 있습니다 주제가 2026년 나의 새해 첫 곡이라 그런지 오늘 여러분들의 신청곡이요.
DJ/GUEST,4741.16,4780.67,39.51,16,3,"SPEAKER_03,SPEAKER_09,SPEAKER_10",진짜 많이 왔어요. 오늘은 진짜 많이 왔어요. 오늘 좀 도톰해요. 이게 항상 대본을 이렇게 중간에 넣어주시거든요. 이 사연들을요. 근데 오늘은 진짜 많이 주셨어요. 우리 청취자분들이 두 분의 목소리로 듣고 싶은 새해 첫 곡이 많은 것 같습니다. 소정씨 사연이 왔나요? 정유진님. 워너원의 에너제틱이요. 워너원분들의 재결합 소식에 에너제틱이 다시 유행가가 될 것 같아요. 후이님의 최고의 곡인 에너제틱이 다시 모두의 귓가에 닿기를 바라며 신청합니다. 후이씨가 또 이 노래를 작사 작곡. 맞습니다. 진짜 대단하다. 제 인생을 바꾼 곡이긴 하죠.
DJ/GUEST,4781.05,4800.23,19.18,9,2,"SPEAKER_09,SPEAKER_10",밥 한번 사라. 밥이 아니지. 성향을 받고 싶은데. 회택아 너 요즘 살림살이 많이 나아졌을 거야. 살림살이 나아졌어. 그런거는.. 다크코스에 맞다야! 그니까! 중지를 틀었네! 사실 제 알을 깨준건 이 친구들 이 노래인데 맞아 맞아!
DJ/GUEST,4800.61,4840.11,39.5,6,3,"SPEAKER_03,SPEAKER_09,SPEAKER_10",그렇지 가광보다는 에너지적이야 우리 소정씨 버전으로도 궁금해 소정씨도 이 남자그룹 노래도 좋아요 파워풀해가지고요 자 어필 좀 해볼게요 작곡가님한테 작곡가님한테 어필 한번 가볼까요? 알겠습니다 Make me feel so high 미치겠어 날 멈출 순 없어 You make me feel so high I'm so crazy 네가 나를 본 순간 너무 좋아해요. 제가 만든 노래를 소정이가 부르니까 느낌이 이상하네요. 저도 기분이 이상해요.
DJ/GUEST,4840.13,4842.81,2.68,2,2,"SPEAKER_09,SPEAKER_10",뭔가 심사받을 것 같고. 제 점수는요?
DJ/GUEST,4844.61,4887.4,42.79,5,2,"SPEAKER_03,SPEAKER_10",왜냐하면 그럴 수밖에 없는 게 서바이벌을 워낙 많이 나가신 소정씨와 심사를 또 많이 하는 후이씨라서. 살짝 부끄러웠어요. 역시 리듬감 있는 노래고 소정씨도 너무 잘해. 사실 제가 이 노래를 만들 때 제가 진짜 건들면 블루스크린이 뜨는 굉장히 안 좋은 컴퓨터를 가지고 방음도 안 되는 공용 작업실에서 만든 거예요 이 노래를 약간 좀 힘들 때 어떻게 보면은 만들었네 데뷔하고 거의 한 1년 정도 지나서 만들어진 노래라서 그래서 마이크도 되게 안 좋은 협소한 엄청 저렴한 마이크로 만든 건데 세상에나 세상에나 이 멜로디를 짰던 그게 떠오르면서 이걸 수정이가 부르고 있으니까 느낌이 이상했나 봐요 느낌이 좀 이상했어요 그만큼 원작자에게 감동을 준 거예요
DJ/GUEST,4887.39,4906.53,19.14,6,2,"SPEAKER_03,SPEAKER_10",잘했어요. 감사합니다. 2026년 새해 첫 곡 어떤 노래 신청곡으로 왔어요? 6709님께서요. 올해 처음으로 들은 노래는 KBS 라디오 스테이션 제로 프로에서 선곡해준 동방신기의 허그였답니다. 올 한 해 가족들 많이 안아주고 쓰담쓰담하면서 살아가렵니다.
DJ/GUEST,4906.67,4954.99,48.32,11,3,"SPEAKER_03,SPEAKER_09,SPEAKER_10",세상에나 세상에나. 이 노래는 사실 우리 남자 가수라면 무조건 한 번쯤 들었죠. 우리 후이 씨의 목소리를 한번 들어볼게요. 이렇게 되었습니다 뭔가 약간 그 라텍스 두 번 추가한 느낌 아시죠? 제가 침대 라텍스 두 번 추가했거든요. 한 번 추가하면 덜 말랑해. 저는 약간 구름 같은 폭신함 좋아해서 라텍스 두 번 추가한 느낌. 라텍스 두 번 추가에 기절베개 한 3개. 꿀잠베개 해야지 꿀잠베개. 숙면베개 한.
DJ/GUEST,4954.97,4970.01,15.04,6,2,"SPEAKER_03,SPEAKER_10",몇 개 더 얹어놓은 듯한 느낌. 너무 좋네요. 근데 그 베이베 부분에서 약간 감성이 많이 들어갔던데요. 사실 이걸 부르면서 그 생각을 했어요. 이거를 제가 베이비로 딱 발음하면 바로 은지 누나가 야 후이야! 네가 이걸 알간!
DJ/GUEST,4970.51,5037.0,66.49,10,3,"SPEAKER_03,SPEAKER_09,SPEAKER_10",하면서 야 후이야! 네가 베이비를 베이비라 불러볼까? 그럴 것 같아서 부르면서 최대한 느낌을 넣어야겠다 여기서. 잘했어요. 감성이 촉촉했고요. 소정씨 한 번 이야기 들어봅니다. 8540님 올해 처음 들은 노래는 코요트의 우리의 꿈입니다. 6시에 일어나 일출 보러 궁평항 가는 길에 상쾌한 아침에서 흘러나오는 노래를 듣고 올 한 해 즐기면서 살아가자고 다짐했답니다. 저 이 노래 가강해서 진짜 많이 불렀는데 부를 때마다 너무 많이 좋아해 주셔가지고 또 해봐야죠 26년이니까 거센 바람 아하!
DJ/GUEST,5038.92,5048.76,9.84,5,2,"SPEAKER_09,SPEAKER_10",어디 전장 나가는 사람 같다. 그 바이브로 불러야 돼요. 나 지금 출동한다. 거북선에 탄 것 같은. 이수진 적은 같았나요?
DJ/GUEST,5049.61,5092.92,43.31,9,2,"SPEAKER_03,SPEAKER_10",이게 막 마음이. 감사합니다. 완전 2026년 새해 첫 곡이고요. 후이 씨는요? 네 다음 곡은요 조화금님께서요 새해가 돼서 앞자리가 5에서 6으로 바뀌었네요 내가 6이라니 적응이 안 돼요 음력생을 세니까 두 달 지나서 다시 생각하려고요 하면서 투어스의 첫 만남은 계획대로 되지 않아 라는 곡을 화금이 누나가 지금 50세셨는데 올해 앞자리가 6으로 바뀌셨대요 화금이 누나한테 새해 복 많이 받으라고 한마디 해줘요 화금 누나 네 첫 만남은 다 어색하고 어렵죠. 제가 그 마음 너무 잘 아는데요. 누구보다 제가 잘 아는 사람으로서 힘을 드리도록 하겠습니다. 노래로서.
DJ/GUEST,5093.02,5113.01,19.99,3,2,"SPEAKER_03,SPEAKER_10",그래요. 우리 화금 누나를 위한 세레나데 부탁할게요. 첫 만남은 너무 어려워 계획대로 되는 게 없어서 첫 만남은 너무 어려워 내 이름은 마려워
DJ/GUEST,5112.99,5135.23,22.24,10,2,"SPEAKER_09,SPEAKER_10",잘 어울린다. 이런 효과음까지. 마지막에 해줘야 되거든요. 후토벤스러웠고요. 소팽스러웠습니다. 이제 여러분들 저희 3부 끝곡을 들으려고 합니다. 소정씨. 레이디스코드의 So Wonderful이라는 노래를 준비했어요. 이 노래 기억이 나시죠? 기억이 나죠.
DJ/GUEST,5135.47,5258.0,122.53,4,2,"SPEAKER_06,SPEAKER_10",요거 3집 3집 타이틀곡인데 아주 귀여운 모습을 이소정씨 20대 귀여운 귀여운 모습이 귀여워 말랐어요 말랐어요 괜찮아요 지금 그러면 바로 들어봅니다 Ladies Code So Wonderful So Wonderful 원더스퀘어 아직도 그대 여전히 멋져요 그대 나무 멋져요 하루 종일 고민이 많아요 여전히 그댄 너무 멋져요 나 없이도 어디서든 매력 넘쳐요 아직도 그댈 웃지 못하죠 난 정말 미쳐요 이러다가 미쳐 미쳐요
AD,5314.36,5419.42,105.06,9,5,"SPEAKER_02,SPEAKER_07,SPEAKER_17,SPEAKER_20,SPEAKER_21","사업장이 여러 갠데 매출, 매입, 지출, 계좌 현황을 한눈에 쉽게 볼 수 없을까? 여러 사업자의 격리 업무도 이제 한 번에 쉽고 편하게 격리회계 프로그램 세계 미술사를 바꾼 인상파의 원화가 노원에 옵니다. 모네, 고흐, 세잔, 르누아르까지 빛과 색채의 혁명을 만든 거장들의 원화를 놓치지 마세요. 노원아트 뮤지엄에서 12월 19일부터 5월 31일까지 지금 인상파 찬란한 순간들을 검색하세요. 살면서 제가 2시를 기다려본 적이 없는데 하디 덕분에 그래도 매일매일 힘을 얻는 것 같습니다. 하디 이제 곧 52시니까 야! 2시가 기다려지는 라디오 안녕하세요 여러분 항상 유쾌한 텐션으로 하루를 밝혀준 우리 하하 유쾌한 텐션으로 하루를 밝히는 라디오 슈퍼라디오 이제부터 더 잘하고 아빠가 영원하면 좋겠어요 청취자 여러분과 영원히 함께하고 싶은 라디오 KBS 쿨 FM 하하의 슈퍼라디오와 함께해주세요 판총물 대박날까 불안하네"
DJ/GUEST,5425.14,5461.49,36.35,5,2,"SPEAKER_06,SPEAKER_10","이윤지의 가요광장 KBS 라디오 이은지의 가요광장 4부 시작했고요. 오늘은 광장코인 노래방 광코너 가수 이소정 씨, 가수 후이 씨 함께하고 있습니다. 2026년 나의 새해 첫 곡이라는 주제로 얘기를 나누고 있는데요. 사인이 있나요, 소정 씨?"
DJ/GUEST,5461.47,5487.54,26.07,5,2,"SPEAKER_09,SPEAKER_10",8834님 1월 1일 12시가 넘은 시간 TV 채널을 돌리는데 박정현 씨가 야외 무대에서 그 추운 날씨에 라이브를 하시더라구요 역시 박정현 날씨 추위 시간 아무것도 따지지 않고 열창한데 너무 멋지더라구요 26년 저의 첫 곡은 꿈에 였어요 언제 들어도 명곡입니다. 꿈에 하자마자 닭살이 쫙 돋았어요. 너무 좋잖아요. 소정씨도 이 노래를 알아요?
DJ/GUEST,5488.28,5520.76,32.48,3,2,"SPEAKER_09,SPEAKER_10","알죠. 제가 중학교 때부터 그 R&B를 너무 좋아해서 우리 그때 파요비 선배님, 박정현 선배님 선배님 거미 선배님 그것만 진짜 쫙 진짜 이 코너와 딱 맞는 그때는 mp3 맞던 때에요 그 고양이 귀 누르면 넘어가고 막 이런거 너무 진짜 추억입니다 이거 한번 우리 소정씨 버전으로 한번 들어볼게요"
DJ/GUEST,5521.19,5615.88,94.69,4,3,"SPEAKER_03,SPEAKER_09,SPEAKER_10",날 안아주네요 예전 모습처럼 그동안 힘들었지 나를 보며 위로하네요 내 손을 잡네요 지친 맘 쉬라며 지금도 그대 손이 그때처럼 따뜻하네요 기억해 줘 여기는 근데 뒷부분 가야 되는데 혹시 이게 아니라면 그대가 이렇게 가야 되는데 제가 기가 되면 뒷부분 준비해 오겠습니다 좋습니다 나중에 또 라이브 선물 한 번 해주세요 후이 씨는요? 네 저는 어허 냥냥펀치님께서요 저는 2026년 첫 곡으로 카라의 프리티가 어리들었어요 다음주에 쌍수 재수술이라는 빅 이벤트를 앞두고 있기도 하고 올해는 프리티한 한 해로 만들고 싶거든요 어디서나 당당하게 걷기라고 보내주셨습니다 오늘 후이씨 자체가 되게 프리티에요 감사합니다 약간 오늘의 후이씨의 패션이 약간 워터멜론 같죠 겨울에 수박처럼 수박 같기도 하고 아니면 영화 해리포터의 말보이 스타일 맞아요 맞아요 오늘 텀블러도 초록색으로 맞췄어요 맞춘 건 아니고 제가 우연치 않게 급하게 들고 나왔는데 보이는 라디오에 좀 보여줘요 저는 안 보였어요 심지어 같은 색깔이라서 진짜 신기하다 오늘 약간 워터멜론 스타일 호이 씨 버전의 음악 들어볼게요
DJ/GUEST,5616.49,5666.05,49.56,2,2,"SPEAKER_03,SPEAKER_10",시원하다 수박이 너무 시원하네요 저 옷을 입은 이유가 있었네요 아주 시원합니다 수박 같은 노래 이쯤에서 우리 구삼지가 가져온 추천곡을 만나볼 건데요 과연 어떤 추천곡을 갖고 왔을지 첫 번째 노래부터 미리 듣게 합니다 음악 주세요 했지만 그대를 사랑했지만
DJ/GUEST,5668.14,5712.74,44.6,3,3,"SPEAKER_06,SPEAKER_09,SPEAKER_10",그저 이렇게 멀리서 바라볼 뿐 다가설 수 없어 소정씨 갑자기 또 어떻게 이렇게 80년대 90년대로 가게 해줘요 제가 또 커버를 해야 되니까 올해는 어떤 노래를 불러볼까 하다가 겨울 노래 하면서 옛날 노래가 생각나서 김광석 선배님의 사랑했지만 요즘 듣고 있어요 커버하려고 그래서 첫 곡으로 가져와 봤습니다 유튜브 소정의 선물 채널에 들어가시면 소정씨가 또 커버를 신나게 올려주고 있어요 최근에는 눈 올라왔어요 눈 이문세 선배님?
DJ/GUEST,5712.76,5733.27,20.51,8,3,"SPEAKER_03,SPEAKER_09,SPEAKER_10",다이언티 씨? 그 전에는 카리나 선배님의 업. 카리나 님은 선배님이 아니시군요. 저보다 동생이시고. 업도 있었고. 자주 올리니까 많이 들어봐 주세요. 다양한 음악 자주 올라오니까 만관부 해주시고. 두 번째 추천곡 들어봅니다.
DJ/GUEST,5734.56,5758.48,23.92,2,2,"SPEAKER_03,SPEAKER_10",유행가 유행가 신나는 노래 나도 한번 불러본다 유행가 유행가 서글픈 노래 가슴 치며 불러본다 송대관 선배님의 유행가 이 노래를 가져온 이유는요?
DJ/GUEST,5758.8,5830.75,71.95,9,2,"SPEAKER_03,SPEAKER_10",일단 저의 2026년 첫 곡이었어요. 정말요? 진짜 첫 곡이었어요. 저도 사실 저는 새해 첫 곡이라는 의미부여를 안지가 작년이긴 해요. 애초에 이런 걸 몰랐었는데 근데 이제 팬분들이랑 대화를 하다가 첫 곡 뭐 들을 거예요? 라고 여쭤보셔서 세상이나 2026년에는 제가 좀 이렇게 대중적으로 사랑받는 음악을 후이의 음악을 만드는 게 저의 꿈이여가지고 그래서 유행가를 들어봤습니다 다 유행 트렌드 세터가 되겠다 멋진 포부입니다 그럼 이제부터 두 분의 추천곡을 걸어두고 경기 진행할게요 노래방 반주 경기 노래방 반주로 전주 부분을 들려드려요 정답 아시는 분은 본인의 이름을 외치고 맞춰주시고 문제는 총 5개입니다 경기에서 이긴 분의 추천곡은 틀어드리지만요 진 분의 노래는 그냥 예약 취소가 되버려요 명색이 가수인데 추천곡을 추천하지 못한 채 쓸쓸하게 집에 간다는 이 마음 그리고 심지어 오늘은 2026년의 첫 대결 작년은 끝난 거예요 맞아요
DJ/GUEST,5831.14,5893.9,62.76,10,3,"SPEAKER_03,SPEAKER_09,SPEAKER_10",아 이해가 안되나요? 제가 3연승 하고 끝났는데? 아니 근데 작년에 통산으로 하면 누가 더 많아요? 제가 이겼겠죠 왜냐면 거의 비슷비슷하다가 제가 마지막에 3연승 했으니까 아마 제가 조금 진짜 1%? 근데 봐봐요 봐봐요 우리가 시작했을 때 제가 초반에 조금 더 많이 이겼던 것 같은 기분이 있네요 근데 마지막에 제가 조금 더 이겼어 아마 조금 비슷하지 않을까요? 그 경기 결과는 저희가 한번 서칭서칭 해가지고 조합을 통해서 다음주에 말씀드릴게요 근데 이제 2026년의 첫 대결 첫 단추 새해 첫 곡 새해 첫 경기 어떤 분의 승리로 돌아갈지 이게 이제 올해의 어떤 기분을 좌지우지하는 그럴 수도 있어요 우리 후이 씨가 또 감상평 남기셨잖아 이 경기 끝나고 나면 그냥 지면 하루가 찝찝하다 맞아요 맞아요 과연 오늘은 어떤 분이 승리하실지. 오늘은 올해가 붉은 말이라서요. 제목에 말이 들어가는 노래.
DJ/GUEST,5894.64,5901.46,6.82,3,2,"SPEAKER_09,SPEAKER_10",말? 말이 들어가는 제목이. 제목에 말이 들어가는 노래들로 준비했다고 합니다.
DJ/GUEST,5901.48,5915.19,13.71,5,2,"SPEAKER_03,SPEAKER_10",어려울 것 같아요. 달리는 말일 수도 있고요. 우리가 하는 말일 수도 있죠. 어떤 말일지. 첫 번째 노래방 반주 경기 문제 주세요.
DJ/GUEST,5915.66,5985.82,70.16,4,3,"SPEAKER_03,SPEAKER_09,SPEAKER_10",정말이죠 이 말이라는 단어를 보자마자 이 노래가 나올 거라는 예상을 하고 근데 언제 나올까만 생각을 하고 있었는데 첫 곡으로 나올 거라고는 감히 예상하지 못했지만 그래도 제가 먼저 외치는 바람에 정답을 외치도록 하겠습니다 정답은요? 정답은 빅뱅의 거짓말 진짜 I'm so sorry but I love you 다 거짓말 미안 몰랐어 이제야 알았어 니가 필요해 고기 고기 이거는 제가 살짝 느렸네요 느렸어요 알았는데 알았어요 그럼요 수정씨 이름 이슈 때문에 느린 것 같다라는 아버님한테 음성편지 녹음해오라니까요 아니 아버지가 들으시고 계셨는데 제가 또 잊어버려가지고 녹음해오면 저희가 소위로 하는 것을 허락하겠다 아버님의 음성편지 기다리고 있습니다 속도전 예상하는 일단 한다 일단 외치고 생각해 두번째 문제 주세요
DJ/GUEST,5988.23,6043.39,55.16,7,3,"SPEAKER_06,SPEAKER_09,SPEAKER_10",소정이 빨랐습니다 창창 둥둥 타만 들었는데 소정이 외쳤고요 창창 둥둥 탁 그거겠죠 당연히 말달리자요 크라잉나 선배님의 말달리자겠죠 말이니까요 이거 어떻게 해? 와.. 운 좋았다 이걸 어떻게.. 이게 제아의 종소리 하고 카운트다운 하고 친구들이 밴드 친구들이 이걸 불렀어요. 제가 봤어요. 나도 봤어. 그래서 생각이 났어요.
DJ/GUEST,6043.45,6080.5,37.05,8,2,"SPEAKER_09,SPEAKER_10",나 우리 언니랑 봤는데. 말달리자겠지? 우리 청취자 조태실님께서 크라잉넛 말달리자 어제 아침 일어나자마자 틀었던 라디오에서 들려온 노래였어요. 그래서 눈을 번쩍 뜨고 커튼을 거드니 밝은 하루가 시작되더라고요. 이렇게 올해도 달려보려고요. 우리 지금 소정씨와 후이 씨도 달리고 있습니다 쉽지 않네요 1대1이고요 2026년에 첫 대결인 만큼 두 분이 뜨겁습니다 후! 후! 내가 더 떨리네요 세 번째 문제 주세요 어?
DJ/GUEST,6080.52,6114.48,33.96,7,2,"SPEAKER_03,SPEAKER_10",와 이거 아예 모르겠는데 와 이거 좀 옛날 쪽이다 그렇죠? 옛날 같죠? 말! 잠깐 말이 들어간다고요? 말? 조금만 더 들어볼게요 말이 들어가는 노래 아는 노래인데 아는 노래인데요 엄청 중요한 멜로디가 지금 나왔어요 엄청 중요한 멜로디에요 힌트가 될 수가 있어요 소정씨 3초의 기회 드립니다 3 2 1 진우션 선배님의 나에게 말해줘 아니에요?
DJ/GUEST,6114.5,6204.19,89.69,6,3,"SPEAKER_06,SPEAKER_09,SPEAKER_10",나에게 말해줘 후이 진우션의 말해줘 이게 무슨 일입니까 줍줍상 바꿔드릴게요 정답을 저에게 말해줬네요 말해버렸어요 아 헷갈렸어요 1316님 문자 주셨습니다 2026년이 붉은말의 해라고 해서 새해 첫 곡으로 진우션의 말해줘 들었어요 말과 관련된 노래를 듣고 연철을 보내면 말에 힘찬 에너지를 전달받을 수 있을 것 같았거든요 다그닥다그닥 이랏 이랏 아 이게 그냥 말해주구나 완전 다 줬어요 맞아요 맞아요 그냥 말해줘요 소정씨 줍줍상 드릴게요 네 반품 드릴게요 자 여러분 지금 세 번째 문제를 했고요 점수는 2대1이 됐고요 소정씨가 여기서 갖고 오지 않으면 허무하게 끝나버려요 이때가 너무 좋아요 한 문제는 일단 줘도 되는데 제가 맞히면 또 이기고 이 여유 매콤한 느낌 네 번째 문제 주세요 어렵다. 노래방 반주여서 어렵다.
DJ/GUEST,6204.21,6288.6,84.39,16,3,"SPEAKER_06,SPEAKER_09,SPEAKER_10",조금만 더 들어볼게요. 알 것 같은데? 어렵다. 괜찮아요? 괜찮아요? 왜 그래 왜 그래 너무 갑자기 죄송해요 너무 신나가지고 뭔데 뭔데 이거 근데 저만 알 것 같아요 제가 진짜 좋아해요 케이윌 선배님의 말해 뭐해? 일소정 대박이다 아니 소정씨 이게 무슨 일이라? 대박 이게 무슨 일이야? 아니 근데 소정씨가 예전에 우리 청취자분들이 막 이렇게 추천곡으로 줄 때 했었어 몇 번 불렀었어요. 제가 또 옛날로 갈수록 공사 공유님께서 사주 봤는데요. 26년도에 이동수 있대요. 어떤 이동일까요? 사운에서 팀장으로 진급 아니면 옥탑방에 살고 있는데 햇빛 잘 들고 엘리베이터도 있는 그런 건물로 이사 뭐든 좋으니 위로 쭉쭉 올라가자. 저는 새해 송으로 케이윌의 말해 뭐해 계속 듣고 있어요.
DJ/GUEST,6289.55,6318.88,29.33,3,2,"SPEAKER_03,SPEAKER_10",아 이 노래였군요 호인씨가 지금 좀 충격을 받았습니다 아니 충격은 아닌데 쉽지 않았어요 피아노가 나오니까 어려웠어요 어려웠어요 제가 또 실력이 늘었나봐요 민윤기씨 문자 주셨어요 혜택씨 표정이 한파 날씨처럼 얼어버렸다 아닌데요 저 웃고 있는데요? 아니 저 여유 있는데요? 저 안보여서 그랬나봐요 워터멜론 수박이 조금 얼었어요 아닌데요 저 아주 신선하고 지금 이게 하우스에 있었어야 했는데 지금 너무 밖에서 판매가지고 막
DJ/GUEST,6319.28,6347.66,28.38,7,2,"SPEAKER_09,SPEAKER_10",이렇게 되면 또 여러분 이렇게 드라마 자꾸 만드실 거예요. 또 2대2잖아요. 어떻게 이렇게 짠 것처럼 맨날 이러죠? 2대2고요. 지금 마지막 문제라고요. 마지막 문제입니다. 자 2026년에 광장코인 노래방 첫 대결 어떤 분이 승리하실지 문제 주십시오.
