block_type,start,end,duration,segments,speaker_count,speakers,text
DJ/GUEST,5944.76,5960.64,15.88,3,2,"SPEAKER_02,SPEAKER_23",정답 아시는 분들은 이름 외치면 되시고 힌트 드릴게요. 배치기 노래가 생각나요 배치기? 만나서 반갑습니다 우리는 배치기입니다 만나서 반갑습니다 힌트 조금 더 드릴까요?
DJ/GUEST,5960.66,5994.2,33.54,11,3,"SPEAKER_02,SPEAKER_05,SPEAKER_23",네 힌트 조금 더 드릴게요 보통 이 얘기를 할 때는 그런 얘기를 해요 우리 초면이죠? 정수? 정수! 처음 뵙겠습니다 정수가 1점 나갑니다 이 편판 판정 아니야? 정답 보여줬죠? 정확하게 맞히지 않았나요? 지 잇몸을 이렇게 한 거 같은데? 잇몸에 아무것도 안 적혀있어요. 티브이 밑에 덮는 거 같아요. 아니야.
DJ/GUEST,5994.46,6002.29,7.83,5,2,"SPEAKER_02,SPEAKER_23",여기 막혀있어. 아니에요. 정수 1점. 감사합니다. 두 번째 문제 갈게요.
AD,6002.31,6002.49,0.18,1,0,,엄마 전화 왔네.
DJ/GUEST,6003.82,6007.06,3.24,2,2,"SPEAKER_05,SPEAKER_23",어머님의 뺨팡팡 종류의 뺨팡팡. 점수 줄이라고.
DJ/GUEST,6007.5,6040.79,33.29,11,3,"SPEAKER_05,SPEAKER_09,SPEAKER_23",받으면 안 돼요. 아마 많은 분들이 가장 소환하고 싶어하는 예능 중에 하나가 아닐까 싶은데요. 바로 무한도전에 대한 문제입니다. 최근에 20주년 팝업스토어도 성황리에 진행이 됐고요. 무한도전에서 화제가 됐던 유재석 씨의 버스 인터뷰 중에 일부. 미국에서 온 따님하고 같이 버스에 타고 있는 시민분이었는데요. 잘 듣고 오디오로 잘 듣고 문제를 맞혀주세요. 어디 가시는 길이세요? 미국에 사는데 가야금 배우고 싶다고 배우고 싶다고? 지금 배우는 중이거든요. 어 그렇구나.
AD,6040.81,6049.28,8.47,4,2,"SPEAKER_19,SPEAKER_20",근데 우리 딸이 한국말을 좀 못해요. 아 그래요? 제가 영어 울렁증이 있어서 영어를 아는 게 몇 단어가 지금 머릿속에 도는데 제가 섬뜩 얘기를 못하겠어요. 그냥 한국말을 하세요.
MUSIC,6050.79,6051.61,0.82,1,1,SPEAKER_19,What's your name?
AD,6051.63,6051.73,0.1,1,0,,사브렌스?
DJ,6052.69,6081.38,28.69,3,1,SPEAKER_23,과연 유재석씨가 사브레 라고 알아들었던 따님의 이름은 무엇이었을까요? 주관식으로 맞혀주세요 이건 뭐 하십쇼 저는 뭐 이미 사브레 무도키즈 정수는 눈치를 챈 것 같고요 모를 수 없죠 무도키즈 정수는 눈치를 챘고요 창준? 창준 실비야 그냥 쉬우신 것부터 얘기하는 것 같아?
AD,6082.18,6082.24,0.06,1,0,,실비야
DJ/GUEST,6083.54,6135.28,51.74,6,2,"SPEAKER_09,SPEAKER_23",힌트 하나 주세요 사브레를 힌트요? 힌트 뭐라고 해야 될까요? 네 글자입니다 네 글자고 우리가 아까 이분에 대한 문자를 한 번 읽었는데 이미 나왔었어요 엑스맨 댄스 시고식에서 이름이 기억이 주현 스테파니 여러분 그 소식 못들으셨죠 최종 우승한 사람 한명 빼고 나머지 두명은 다 벌칙이에요 아 그래요? 뭐야 그럼 내가 지금 이러고 있을 때가 아니었네 그러고 있을 때가 아니었어요 총 다섯문제잖아요 그렇죠 주연 1점 정수 1점 장준 0점 장준 괜찮아요? 안괜찮죠
DJ/GUEST,6135.26,6235.48,100.22,14,2,"SPEAKER_02,SPEAKER_23",솔직하다. 나머지 문제를 다 맞춰야지 최종 우승하는 거예요. 세 번째 문제 드립니다. 음악 문제. BGM이 유명한 예능들이 있습니다. 예를 들어. 박수홍 선배님. 맞아요. 어디 집에만 들어갔다 하면 입으로 따라했던 브금. 러브하우스에 나왔던 거고요. 혹시 이 음악도 기억할까요? 울어야 되잖아요 TV는 사랑을 싣고 애 낳았던 음악 여기서 문제 드리겠습니다 이제 곧 들려드릴 음악이 한 프로그램의 엔딩에 나왔던 노래예요 1999년부터 2020년에 방송됐던 진짜 오래했네 진짜 오래했네 이 프로그램이 무엇인지 맞춰주시면 되는데 느낌적으로요 속도전 예상합니다 네 속도전 예상합니다 음악 주세요 장준 골든벨 정수 한 번 더 기회 드리는데 여기서 못 맞히면 정수에게 갑니다 장준 울려라 골든벨 지은 도전 골든벨 미치겠네 진짜 도전이구나
DJ/GUEST,6236.83,6248.22,11.39,7,2,"SPEAKER_09,SPEAKER_23","정수 뺏겼어! 어차피 틀렸네요. 전 스타 골든벨 할라 그랬어요. 주현! 뭐야! 혼자 앞서고 있어. 주현 2, 정수 1, 장준 0점입니다."
DJ/GUEST,6248.24,6296.08,47.84,11,2,"SPEAKER_08,SPEAKER_23","2, 주현! 형 어떻게 된 거예요? 큰일 났네, 이거. 큰일 났네. 준형 너무 봐주신다. 어우, 웬일이야. 세상에나, 세상에나. 네 번째 문제에 2점을 걸자라는 얘기가 나왔습니다. 가요, 가요? 우리 가요, 더블로 가! 2017년 한 온라인 조사회사에서 종영환TV 프로그램 중 가장 그리운 추억의 프로그램에 대해 설문조사했습니다 다음은 순위에 오른 새 프로그램 잘 듣고 1위부터 3위까지의 순위를 맞춰주십시오 1번 엑스맨 2번 해피투게더 쟁반 노래방 3번 이경규의 몰래카메라 가장 그리운 추억의 프로그램을 1위부터 3위까지로 말씀해주시면 됩니다 1위부터 3위까지 라메까르물거니 라메까르물거니"
DJ/GUEST,6297.46,6334.6,37.14,3,2,"SPEAKER_02,SPEAKER_23",거꾸로 하면 이건 몰래카메라 이건 몰랐다 잠깐만 엑스맨 그리고 뭐에요? 헬피투게더 쟁반 노래방 아 쟁반 노래방 그리고 이경규의 몰래카메라 장준 먼저 가볼게요 숫자로 얘기할게요 네 아니죠 이름까지 다 해야죠 이현님 까다롭네 오늘 첫 번째 엑스맨 두 번째 이경규의 몰래카메라 세 번째 쟁반 노래방 됐다 뭐라고요? 엑스맨 몰래카메라 쟁반 노래방 어?
DJ/GUEST,6335.01,6349.64,14.63,5,2,"SPEAKER_08,SPEAKER_23","진짜? 주현! 엑스맨, 쟁반 노래방, 몰래카메라. 진짜요? 둘 다 1위가 틀렸어요."
DJ/GUEST,6349.66,6399.69,50.03,17,4,"SPEAKER_02,SPEAKER_05,SPEAKER_09,SPEAKER_23","엑스맨이 1위가 아니네. 정수! 쟁반 노래방, 엑스맨, 이경규 몰래카메라. 주현! 몰래카메라. 장준! 쟁반 노래방, 그리고 뭐였냐? 정수! 몰래카메라 엑스맨! 정수! 정수! 쟁반 노래방, 이경규 몰래카메라, 엑스맨! 뭐야? 뭐야? 뭐야? 이게 무슨 일입니까 지금 정수 3점 주연 2점 장준 0점인데요 마지막 문제가 지금 남았고요 이거 몇 점 걸어야 될까요 장준씨?"
DJ/GUEST,6399.71,6404.47,4.76,3,2,"SPEAKER_02,SPEAKER_23",8경 팔경점 걸죠. 팔경.
DJ/GUEST,6404.49,6431.01,26.52,9,3,"SPEAKER_02,SPEAKER_08,SPEAKER_23",팔경점. 저희 승부사들입니다. 완전 쾌남들이야. 오케이. 쿨 FM. 그럼 진짜 마지막 팔경이 걸린 마지막 문제. 2007년 현재 시즌4까지 방영 중인 KBS 대표 예능 1박 2일. 다음은 1박 2일 24회 방송에서 강호동 씨와 이승기 씨가 나눈 대화. 잘 듣고 이어지는 문제를 맞춰주세요.
DJ/GUEST,6430.99,6458.91,27.92,11,2,"SPEAKER_09,SPEAKER_23",점심 뭘로 먹어요? 돈 없는데. 지금도 최고의 명장면으로 꼽히는 장면. 너 나 없이 살 수 있어? 라는 강호동씨의 질문에 이승기씨의 레전드 명언이 나왔어요. 과연 뭐라고 했을지 주관식으로 맞춰주세요. 길잖아요 이거. 자 길어요. 그래서 힌트. 땡땡하겠죠. 땡땡하겠죠.
AD,6458.93,6458.99,0.06,1,0,,그치만
DJ/GUEST,6459.88,6500.61,40.73,10,3,"SPEAKER_08,SPEAKER_09,SPEAKER_23",땡땡하겠죠 잠깐만 잠깐만 아 잠깐만 정말 아예 모르겠다 잠깐만 자 어떤 느낌이냐면 아 이거 아는데 탄디의 액션 힌트 땡땡하겠죠 눈이 빠지겠죠 땡땡하겠죠 억울하겠죠 그치만 땡땡하겠죠 장준 보고 싶겠죠 힘들겠죠 하지만 살 수 있죠 아 장준아 장준아! 주연! 보고 싶겠죠? 힘들겠죠? 슬프겠죠? 정수! 보고 싶겠죠? 힘들겠죠? 아니네.
DJ/GUEST,6501.29,6514.67,13.38,9,2,"SPEAKER_08,SPEAKER_23","자, 대왕 힌트 한 번 더. 보고 싶겠죠? 맞아요. 보고 싶겠죠? 보고 싶으면 어때? 땡땡하겠죠? 주연! 보고 싶겠죠? 그리워하겠죠?"
AD,6514.69,6514.81,0.12,1,0,,하지만...
DJ/GUEST,6515.89,6598.5,82.61,15,4,"SPEAKER_02,SPEAKER_05,SPEAKER_08,SPEAKER_23",장준! 3. 살겠죠? 뭐라고요? 살겠죠. 그냥 살겠죠. 살아야죠. 너무 99%로! 장준! 보고 싶겠죠? 그립겠죠? 하지만 살 수 있죠! 팔경 살 수 있겠죠 였습니다 정답을 음성으로 한번 들어봅니다 나 살 수 있어? 살 수 있겠죠 이렇게 해서 오늘의 점수 장준 팔경 점수 3점 주연 2점 역시 팔경 점 좀 대단하다 정말 대단하고요 미쳤다 장준씨가 승리를 해서 혼자만 벌칙을 안하고 우리 엑스티더리 히어로즈 주연씨와 정수씨는 벌칙을 하게 돼서 기쁜 사람이 장준씨와 빌런즈네요 그 영상을 저희가 찍어서 이윤지의 가영화장 인스타그램에 올릴거라서 빌런즈는 행복해하고 있습니다 좋네요 좋네요 저는 빌런즈 행복하면 행복하죠 너무 감사드리고 오늘 어땠는지 우리 주연씨부터 얘기해주세요 뭐 하시고 싶은 이야기
DJ/GUEST,6598.48,6623.75,25.27,7,2,"SPEAKER_08,SPEAKER_23",일단 오늘 또 트렌드랑은 아주 연관이 없었지만 그래도 제가 나와서 또 트렌드와 한 발짝 가까워진 기분이 들고 또 은지 누나 보고 준희 형 보고 같이 재밌게 수다 떨고 가는 것 같아서 굉장히 재밌었습니다. 자주 와줘요. 너무 좋죠. 너무 고맙고 우리 수수. 다 필요 없습니다. 주현 씨 표정. 물까지 사랑해?
DJ/GUEST,6623.77,6656.56,32.79,4,2,"SPEAKER_09,SPEAKER_23",저는 다 필요 없어요. 누나만 있으면 돼요 보고 싶겠죠 그러나 잘 순 없겠죠 너무 감사드리고 우리 수수 우리 주연 씨 우리 장준 씨 모두 건강하게 활동 잘 해야 돼요 장준 씨 오늘 어땠어요? 평범한 하루에요 다음 주에 만나고요 세 분 보내드리면서 골든차일드 너라고 듣겠습니다 오늘 고맙습니다
GUEST,6661.98,6734.22,72.24,2,1,SPEAKER_05,just for you huh you make me feel like you girl but in love with you it's all I wanna do yes everybody can't stop me now 뭘 해도 둔하니 왜 반응이 없어 너만 보고 있는 내가 안 보여 어느 날 갑자기 여자로 네가 보여 빼지 말고 왼손이라는 건데 슬쩍 잡히면 돼 키스라도 해야 액션을 취해줄 거니 날 마치 없는 것처럼 무시하고 있잖아
AD,6750.79,6759.05,8.26,1,1,SPEAKER_03,이 곡은
GUEST,6771.72,6834.21,62.49,2,1,SPEAKER_05,맑고 달콤이라는 건데 슬쩍 잡히면 돼 화려한 맘 아냐 쉽게 한 말 아냐 계속 생각해봐도 난 너뿐이라서 그래 이 세상에 무엇보다 제일 탐나는 게 네 맘인걸 어떡해 나라고 나라고 빼지 말고 내 꿈이란 건데 슬쩍 잡히면 돼 너 어때?
AD,6834.23,6837.06,2.83,1,1,SPEAKER_04,숨을 잡아 너와 나 따라 울려 부끄러워하지 마 용기를 내 어서 날 따라와 걱정 마 잘해줄게 Oh tell me tell me baby 나나나나나나 너라고 너라고 비말 아니야
DJ,6840.04,6951.82,111.78,9,1,SPEAKER_23,"이은지의 가을광장에서 준비한 1월 선물입니다. 건강하고 편한 더마름 다이어트에서 가인미가 신마름 비트상품권 고고론에서 애슐런 스테어 클라이머 발갈이 박준영의 싱크퓨어에서 음식물 분쇄 처리기 급발진 잡넷 지넷에서 한문철 블랙박스 에브리바디 엑센코리아에서 디스플레이 블루투스 이어폰 클림트 어워드 수상작가 주니 퀸 갤러리에서 디지털 아트 작품 아름다운 비주얼 아비주 뷰티에서 뷰티 상품권 메디컬 스킨케어 브랜드 DMS에서 코르테 화장품 세트 바찌 화장품에서 어성초 샴푸, 선크림, 알로에 젤 시선이 머무는 아름다운 뷰뷰의 코스메틱에서 온라인 상품권 HPNC에서 엔자인 워싱 파우더와 링클 앰플 패드 화장품 직접 재배 병풀 사용 톤28에서 시카 새벽크림 교환권 2025 에이펙 공식 후원 리포브에서 화장품 세트 레몬과 허브의 조화 파마블랜드에서 유기농 레몬즙 스틱 나를 위한 온전한 휴식 니노바 화장품에서 페이스 앤 넥 듀오 마스크팩 댕댕이 간식 전문 닥터 그레인팝에서 휴먼 그레이드 유기농 간식 세트 방송 PPL 플랫폼 비전기획에서 메르베 쥬얼리 대한민국 양념치킨 초갓집에서 치킨 상품권 스마일 에브리데이 프레임윈트에서 프리미엄 덴탈 케어 세트 클라클라 제클라 스포츠 브랜드 제클라에서 라이크라 볼캡 속편한 하루를 위한 두 알 스톰에서 프리미엄 식이섬유 정 독일 기술 정점 브랜앤스툴에서 슈퍼솔리드 고용량 멀티탭을 드립니다. 취자들 새해에도 가요광장 곶간 가득 채워놨어요. 2026년도 가요광장과 꼭 함께 해주시고요. 새해 복 많이 받으세요."
AD,6955.13,6981.24,26.11,1,1,SPEAKER_13,은지야 오늘도 가요광장 바이브가 엄청나는데 나 다그닥다그닥 슈퍼라디오로 가고 있어요 여러분 가요광장 마저 잘 들으시고요 저는 이따 2시에 하이 슈퍼라디오에서 만날게요 야맘뿡 아저씨
DJ/GUEST,6982.45,7029.33,46.88,6,2,"SPEAKER_05,SPEAKER_23",이은지의 가요광장 오늘은 여기까지 내일은요 가광초대석 누구세요? 이분들이 오십니다. 2026년 새해에 가장 기대되는 컴백팀 중에 한 팀 그룹 에이핑크와 함께하도록 합니다. 오늘의 끝 꼭 와우 없네요 아쉬워라 끝곡 듣고 싶었는데 없대요 오늘 끝곡 없지만 여러분 내일 또 많이 많이 기대해 주시고요 저희가 또 OMG 벌칙 그 시절 댄스 신고식 버전으로 찍어서 이은지의 가요광장 인스타그램에 올려놓을게요 내일도 비타민 충전하러 오세요 안녕 고맙습니다.
AD,7036.52,7210.0,173.48,23,5,"SPEAKER_07,SPEAKER_11,SPEAKER_16,SPEAKER_18,SPEAKER_19",KBS 쿨 FM 57분 교통정보입니다. 자녀가 있는 분들은 새해를 맞아 가족 여행을 가신 분들이 많아서인지 오늘 낮시간 도로 지나시기 평소 이 시간보다 수월한 편인데요. 오후 2시가 가까워지고 있지만 공항 쪽 올림픽대로 영동대교에서 동작대교 사이로만 짧은 정체에 이어지고 더 가서 가양대교 부근 양방향 4차로에서는 각각 작업하면서 부근으로만 차선 변경 발생하고 있습니다. 구리쪽 강병북로도 원효대교부터 동작대교 사이로 잠시 주춤하고요. 이밖에 내부순환도로와 동부간선도로 등 대부분의 길 제속도로 지나는데요. 다만 서부간선 지하도로 일직방향 성산대교 남담부근 2차로를 막고서 시설물 보수작업이 시작됐습니다. 옆파로 나란히 가는 서부간선도로 양방향 전구간에 걸쳐 지체서행하고 있습니다. 살펴 지나셔야겠습니다. KBS 쿨 FM 57분 교통정보 공인회였습니다. 모든 인쇄 가능한 성원에드피아 온라인 줌은 간편한 성원에드피아 누구든지 어디서나 쉽고 빠르게 인쇄의 유토피아 성원에드피아 디지털 인쇄도 역시 성원에드피아 국민 인쇄 성원에드피아 코 입술 주름 개선을 위해 피부 깊은 곳부터 자연스럽게 PLLA로 부드럽게 채우다 올리비아 저희 라디오는 어떤 매력이 있을까요? 라디오는 생각보다 말씀하시는 게 좀 침착하시고 조언하시는 것도 되게 진솔하시고 현실적이어서 듣기 좀 편안하고 또 재밌기도 하더라고요. 감사드리겠습니다. 굉장히 저희가 추구하고 있는 바와 똑같은 말씀을 해주셨어요. 침착하고 진솔하고 듣기 편안하고 재밌기도 한 DJ 박명수. 매일 오전 11시 여러분들과 함께합니다. 박명수의 라디오쇼. 2시간 했으면 좋겠습니다. 안 돼요. 왜요? 1단계 2단계 KBS가 업그레이드합니다. KBS 플러스 KBS만이 제공 가능한 무료 서비스 스마트폰에서 즐겨보세요. 40개의 실시간 채널 5만 개의 다시 보기 KBS의 과거 현재 프로그램을 소환해서 볼 수 있습니다.
