block_type,start,end,duration,segments,speaker_count,speakers,text
DJ/GUEST,4177.55,4223.77,46.22,8,2,"SPEAKER_09,SPEAKER_23",진짜 완전 장난 아니야. Stay with me고요. 우리 엑스티너리 히어로즈 정말 콘서트 장인들이니까 정말 많이들 가서 재미나게 또 즐겨주셔요. 아니 엑시즈분들이 가요광장을 왔지만 세상에나 세상에나 난리가 났어요 지금 그 우리 로고송을 만들어 줬대요 이은지의 가요광장 로고송을 만들어 줬다는 이야기 정수씨 원래 어떤 노래로 이렇게 했어요 저희 노래에 로스트 앤 파운드라고 굉장히 좋은 노래가 하나 있는데 잃어버린 은디누나 찾아서 한번 연하남 맞네. 플로팅이 장난 아니라니까. 은눈을 찾아서 노래를 한 곡을 기깔나게 말아왔죠.
DJ/GUEST,4223.78,4265.45,41.67,5,2,"SPEAKER_09,SPEAKER_23",미치겠다. 얼마나 찾았는지 같이 들어볼 건데요. 일단 로스터 앤 파운드를 개사해서 노말 버전과 샤우트 버전. 어떻게 노말 버전부터 한번 들어볼게요. 아 좋다 굉장히 청아하게 은두나를 향한 사랑을 담아봤는데 그치만 여기서 끝이 아닙니다 또 아니에요?
DJ/GUEST,4266.19,4366.02,99.83,8,3,"SPEAKER_02,SPEAKER_09,SPEAKER_23",더 듬뿍 담아봤어요 날량한 사랑이 조금 더 있어요? 아 이거 부족하죠 미치겠다 다른 버전이 또 있는 거네 엄청나게 담아봤습니다 샤워 투 버전 한번 들어볼게요 자 익숙해져버린 내일같이 또 반복해 아 맞아요 맞아요 백태가 있네요 커피를 두 잔 먹었어요 커도 때리면 또 있죠 저는 백태녀 할게요 아이고 아우 수수 우리 주연씨 너무너무 고마워요 아 아닙니다 사랑을 터뜨려봤어요 사랑을 터뜨려봤대 진짜 아니 근데 궁금한게 우리 수는 가공장을 놀러올때마다 은지누나에 대한 사랑을 좀 많이 이렇게 장준씨 왜 비웃는건지 궁금해요 진심이에요? 그럼요 진행하세요 신경쓰지 마세요 은진 누나에 대한 사랑 다른 누나한테도 전파해본적 있어요? 저희 팬분들 빌런즈 말고는 처음이에요 어떡하냐 준아 이거 누나 어떡하냐 준아 너 그렇게 누나 놀리면 못쓰는데 누나도 나름 어디가서 방귀 뀌는 사람이야 방귀 뀌는 사람이야 누나한테 그렇게 마음을 흔들면 안돼 누나 요새 적적해 많이 적적해요 적적해요? 저도 제가 있잖아요
DJ/GUEST,4368.43,4404.81,36.38,4,2,"SPEAKER_02,SPEAKER_23",정말 행복합니다 여러분 우리 여러분들 이렇게 또 엑스테리 히어로즈 분들과 장준씨와 함께해서 너무너무 행복하고 정효민님도 지금 행복해 죽습니다 우리 정효민님의 문자 읽어줘요 주연씨 완전 잠을 깨우는 로고송 아 완전 깨로워 아니 주연씨한테 읽어달라 그랬는데 왜 아 저한테 아 저한테는 아니에요? 주연씨라고 했는데 왜 정준씨가 질투 너무 재밌다 그게 아니라 질투에요? 아니 이렇게 셋이서 하는게 처음이어서 원래 대부분 이 자리에 백호형 있고 그러다가 나도 헷갈렸어요 헷갈렸어요 4년차라 그럴 수 있어요 임혜정님
DJ/GUEST,4404.79,4441.72,36.93,3,2,"SPEAKER_09,SPEAKER_23",골드니스인데요 사촌동생이 빌런즈라서 같이 듣고 있어요 오늘 저희 자매를 위한 뷔페같은 종합선물세트 조합이라 행복합니다 진짜 기대할게요 한 분은 골드니스 골든차일드의 팬덤명이죠 그리고 한 분은 빌런즈 우리 엑스디너리 히어로즈의 팬인데 좋네 이렇게 고하영님 주현식 읽어줘요 오늘 네 분 드레스코드 컬러 맞췄나요? 눈이 편하네요 눈이 편하네요 우리 다 약간 다 이렇게 무채색으로 저는 오늘 누나 착장이 제일 마음에 들긴 하는데 이 바라클라가 너무 귀엽더라고요 깜찍하죠?
DJ/GUEST,4442.04,4461.13,19.09,4,2,"SPEAKER_05,SPEAKER_23",진짜로 왜요? 왜 또 그런 눈빛 보내시는지 아니요 아니요 이유가 있으실까요? 아니요 없어요 없어요 약간 누나 소개팅하는 거 쳐다보는 천암 맞네 천암 맞네 맞죠? 천암이네요
DJ/GUEST,4461.11,4532.04,70.93,17,4,"SPEAKER_02,SPEAKER_08,SPEAKER_09,SPEAKER_23",천암이라니까 천암이라니까. 복천. 복천. 아 마음에 들고요. 실시간 문자까지 왔고요. 은진의 편지쇼 OMG 이번 주 유행템 확인해봅니다. 장준쌤. 네. 자 2005년부터 2016년까지 KBS에서 방송됐던 예능 중에 위기탈출 넘버원이라고 있었는데 기억들 하시나요? 이 프로그램이 10년 만에 새로운 시즌으로 부활을 해서 첫 방송이 됐는데요. 반가워하시는 분들이 많으시더라고요. 그래서 오늘의 주제 이렇게 정해보았습니다. 추억 소환 트렌드 다 돌려놔 예를 들어 라떼는 모든 예능 프로그램의 시작이 댄스 신고식이었거든요 그거 부활했으면 좋겠어요 KBS 예능 중에 공포체험 돌아보지마라는 프로그램이 있었어요 당시에 여배우분들이 많이 나왔었는데 5세대 아이돌 버전으로도 보고싶어요 등등 여러분들이 즐겨봤던 애정했던 예능 2026년에 소환해서 부활시키고 싶은 예능 속 코너 어떤 것들이 있는지 또 프로그램과 관련된 에피소드가 있다면 같이 보내주세요 번호는 샵8910 짧은 문자 50원 긴 문자는 사진 문자는 100원이고요. 어플 콩과 KBS 플러스는 무료. 소개된 분들 중 추첨을 통해서 블루투스 이어폰 보내드립니다.
DJ/GUEST,4532.2,4548.2,16.0,3,2,"SPEAKER_05,SPEAKER_23",아이 좋습니다. 여러분들의 추억 소환 트렌드를 기다리며 저희는 노래 듣고 오게요. 하하 키 작은 꼬마 이야기
AD,4560.35,4748.2,187.85,7,1,SPEAKER_03,에브리바디 모두 put your hands up 에브리바디 모두 throw your hands up 에브리바디 모두 put your hands up 에브리바디 모두 죽지 않아 키가 작은 꼬마 동훈이 내 얘기를 들어보세요 받았으기 쉽죠 동네 꼬마 비구석 나랑 키도 비슷해 이거 참 난 속사인데 키도 작고 못생겼는데 가진 것도 하나 없는데 키가 작아서 나는 행복해 세상 모든 것을 불어넣어 볼 수 있으니까 나는 행복해 니가 막심한 스카이저 소재 소녀도 루엣 스파르타 죽지 않아 나는 죽지 않아 오오오 나는 죽지 않아 니가 막심한 스카이저 소재 소녀도 루엣 스파르타 죽지 않아 나는 죽지 않아 꿈이 많은 꼬마 동훈이 하고 싶은 게 참 많아지 노래하고 싶다고 무대 서고 싶다고 앨범까지 냈는데 이거 참 아무도 몰라 마음대로 안 풀린다고 마음먹기 나름이라고 절대 놓치고 싶지 않아 넘어지면 또 다시 일어나면 되니까 나는 괜찮아 니고 막시모 스카이저 소우세 소녀두루엔 스파르타 죽지 않아 나는 죽을래 니노마시모 스카이저 소재 소냐도 루에스 바른다 죽지 않아 나는 죽지 않아 나는 키 작은 꼬맹이니까 사랑이 실패해도 절대 죽지 않아 사업에 실패해도 절대 죽지 않아 시험에 떨어져도 절대 죽지 않아 You and I we are one 죽지 않아 나는 죽지 않아 나는 시작은 꿈에 이르니까
DJ/GUEST,4749.97,4771.63,21.66,9,2,"SPEAKER_02,SPEAKER_23",하하 키 작은 꼬마 이야기. 이 노래도 이제 예능 무한도전. 또 오늘은 주제가 트렌드잖아요. 트렌드. 옛날 예능 트렌드. 추억 소환 트렌드라서 이렇게 이 노래를 띄워봤고요. 아니 근데 진짜 옛날 예능 하니까 궁금한 게 있긴 하다. 장준 씨는 근데 워낙에 예능을 많이 알아서. 네네네네.
DJ/GUEST,4771.61,4797.11,25.5,5,3,"SPEAKER_02,SPEAKER_08,SPEAKER_23",좋아하는 예능이 있었어요? 좋아하는 예능이요? 사실 뭐 1박 2일 무도 요런거는 당연히 다 좋아했는데 저는 약간 그런거 좋아했어요 출발 드림팀 재밌었어 그거 왜 부활 안하는지 부활하면 좋을거 같은데 요런 느낌쓰 주현씨는 좋아했던 예능? 저는 우리 동네 예체능. 예체능.
DJ/GUEST,4797.73,4803.52,5.79,2,2,"SPEAKER_08,SPEAKER_23",기억 남는다. 제가 운동하는 거 스포츠 이런 거 엄청 좋아해가지고 그때 당시 그거 엄청 많이 봤었어요.
DJ/GUEST,4803.54,4814.76,11.22,2,2,"SPEAKER_08,SPEAKER_23",그게 아마 당대 최고의 체육 스타들이 다른 운동에 도전하는 거였나? 그거는 뭉쳐야 산다.
DJ/GUEST,4814.74,4901.76,87.02,10,2,"SPEAKER_09,SPEAKER_23","아 뭉쳐야 찬다 뭐 이런거였고 예천에는 다른 스포츠들 막 이렇게 경험해보는 강호동 선배님의 탁구도 하고 아 그렇네 스포츠 예능 쪽을 좋아하는구나 저는 무드퀴즈였습니다 아 무도퀴즈! 완전 무도퀴즈였어가지고 뭐 어떤 짤들 토요일마다 항상 TV 앞에 기다리고 그러네요 이렇게 다들 퀴즈들이 있어요 어떤 무도퀴즈, 1박 2일 퀴즈, 런닝맨 퀴즈 우리 청취자분들은 어떤 사연들이 왔을지 텐디가 너무너무 궁금한데 아 공포의 쿵쿵따 이야기도 있고 아 너무 재밌었지 우정님이 문자 주셨네요 추억의 예능 아빠 어디가요 단순 육아 프로그램이나 요즘 유행하는 해외여행 프로그램이 아니고 아빠와 아이가 국내 곳곳을 여행하는 모습을 부담없이 즐길 수 있는 힐링이 되는 프로였던 것 같아요 그러네요 진짜 아이들이랑 아빠랑 이렇게 또 둘이 여행가는 게 쉽지 않은데 이것도 보는 재미가 있었어요 짤도 많이 생겼고 이때 아마 랜선 조카라는 말이 이때 나왔었거든요 랜선 이모, 랜선 조카 이때가 나왔던 것 같아요. 0486님. 위험한 초대. 이거 진짜 다시 봐도 너무 재밌어요. 플라잉 체어에 앉아 게스트가 하는 말이나 행동에 따라 위에서 물이 쏟아지거나 날아가는 재미. 그땐 저 플라잉 체어 꼭 한 번 앉아보고 싶다 생각했는데 말이죠."
DJ/GUEST,4901.78,4909.12,7.34,4,2,"SPEAKER_09,SPEAKER_23",수우 이거 뭔지 알아요? 잘 몰라요. 왜 몰라요 이거를? 이거요?
DJ/GUEST,4909.14,4940.74,31.6,8,3,"SPEAKER_05,SPEAKER_09,SPEAKER_23","아 그냥 이게 그런 게 있다 정도만 알았고 한 번도 프로그램 본 적은 없어요 이게 그 플라잉 체어라고 의자에 앉아요 해가지고 뭐 이렇게 벌칙을 맞으면 그 체어가 날아가는 뒤로 날아가서 수영장 뒤로 물 속에 부아악 그런 프로예요 재밌겠네 수, 물놀이 하는 거 좋아해요? 아 그럼요 물 너무 사랑하죠 서핑이나 물도 사랑해? 입에 뱉나봐. 물도 사랑해? 다 사랑하네 진짜. 다 사랑해? 저 사랑하는거 많습니다. 물도 너무 사랑하고."
DJ/GUEST,4940.88,4946.71,5.83,3,2,"SPEAKER_05,SPEAKER_23",나 주현씨 멘트가 너무 웃기다. 물도 사랑해? 물도 너무 사랑합니다.
DJ/GUEST,4946.73,4978.11,31.38,5,2,"SPEAKER_08,SPEAKER_23",아니 호핑투어 나. 수영. 호핑투어 좋지. 수영할 줄 모릅니다. 마시는 수분 섭취가 중요하니까 그래서 목소리가 촉촉한가봐요 너무 모이스처해 저는 어릴 때 스펀지 진짜 열심히 봤어요 나중에 어른이 되면은 실험에 참가하는 일반인 참가자가 되고 싶었어요 그런데 어른이 되기 전에 프로그램이 사라져 버려서 이룰 수 없는 꿈이 되어버렸네요
DJ/GUEST,4978.09,5000.16,22.07,4,2,"SPEAKER_08,SPEAKER_23",스펀지 알아요 주윤씨? 알죠 알죠 네모는 뭐뭐다 너무 재밌었어요 재밌는 실험 많았어요 아니 실험들 중에 난 기억에 남는게 소가 머리를 핥으면 고정력이 얼마나 될까 뭐 이런게 있었어 언제 실험을 했어요? 실제로 핥아요?
DJ/GUEST,5001.38,5016.52,15.14,4,2,"SPEAKER_02,SPEAKER_23",그래서 실험자분들이 머리에다 여물을 뿌려요. 여물을 뿌려서 소한테 갖다 대면 소가 막 핥는단 말이야. 근데 그 고정력이 장난 아니었던 그런 기억이 나. 실험맨.
DJ/GUEST,5019.18,5054.23,35.05,7,2,"SPEAKER_08,SPEAKER_23",대박이다. 잘 찾아보면요 KBS 개그맨 선배님들이 옛날에 실험만 했던 분들이 많아요 와 진짜요? 신인 개그맨들 좋잖아요 서로서로 품하신 느낌으로 돈도 벌고 실험도 하고 이렇게 했다 출연료도 받을 수 있으니까 유 솔지님도 문자 주셨습니다 공포의 쿵쿵따 당시에 끝말잇기 엄청 했어요 틀리면 벌칙 받는 것도 너무 재밌었고 쿵쿵따리 쿵쿵따 다시 해줬으면 좋겠어요 기억에 남네요 너무 재밌었죠 장준씨는 이거 무조건 알 것 같고 주연 정수 알아요? 저도 게임은 압니다. 디비디비딥. 영어 식스. 이거 음도 알아요?
DJ/GUEST,5054.29,5062.15,7.86,7,2,"SPEAKER_09,SPEAKER_23",꿍스. 꿍스. 꿍스. 꿍스. 꿍스. 꿍스. 꿍스.
AD,5064.32,5065.52,1.2,1,0,,쿵!
DJ/GUEST,5065.54,5075.35,9.81,8,3,"SPEAKER_05,SPEAKER_09,SPEAKER_23",쿵! 쿵! 쿵! 쿵! 쿵! 쿵! 쿵! 쿵!
DJ/GUEST,5075.37,5109.28,33.91,14,2,"SPEAKER_09,SPEAKER_23",쿵! 쿵! 쿵! 쿵! 쿵! 쿵! 쿵! 쿵! 쿵! 쿵! 쿵! 쿵! 쿵! 이게 예능에도 많은 종류가 있잖아요 뭐 토크쇼가 있을 수도 있고 뭐 버라이어티 아니면 뭐 게임하는 예능 뭐 아니면 어디 가서 짚고 치는 예능 뭐 마라톤 하는 예능 뭐 이런 다양한 예능이 있어서 장준씨는 뭐 정말 많이 해봤겠지만 우리 정수씨나 주현씨는 뭐 해보고 싶은 예능 같은 거 있어요?
DJ/GUEST,5109.72,5120.35,10.63,3,2,"SPEAKER_08,SPEAKER_23",언젠간 하게 된다면 사실은 제가 정말 애청했었던 거는 신소유기 같은 거였거든요 잘하더라. 15회화 때 잘하더라.
DJ/GUEST,5120.65,5125.84,5.19,2,2,"SPEAKER_08,SPEAKER_23",저도 너무 보고 싶은데 했던 기억이 항상 있었어요. 그 15회화 촬영했을 때 재밌었겠네요.
DJ/GUEST,5125.86,5129.93,4.07,3,2,"SPEAKER_08,SPEAKER_23",너무 재밌었어요. 진짜. 뭔가 이렇게 게임하고 같이 가족처럼 할 수 있는 눈에.
DJ/GUEST,5130.37,5149.51,19.14,5,2,"SPEAKER_08,SPEAKER_23",또 영석이 형 그 보는 게 굉장히 연예인 보는 느낌. 아 영석이 형 봤어요? 네. 진짜 연예인 보는 느낌. 그게 굉장히 신기했었어요 나영석 피디님은 어쩌다가 모든 사람들이 다 영석이형이라고 하더라고 팬들도 영석이형이라고 다 하더라고 팬이니까 정수씨도 진짜 하고싶은 예능?
DJ/GUEST,5149.71,5168.29,18.58,3,2,"SPEAKER_09,SPEAKER_23",저는 누나랑 같이 패밀리 겠다고 하고싶어요 아침에 눈 뜨면 누나 얼굴 보고 뭐 이런거야? 자기 전에 누나 얼굴 보고 밥도 해주고 패밀리가 떴다 하면 아침에 일어나서 같이 새벽일 해야 되는데 할 수 있겠어요?
DJ/GUEST,5168.43,5188.56,20.13,3,2,"SPEAKER_09,SPEAKER_23",제가 누나꺼 다 하면 되죠 손에 물 안 묻힐거야? 그럼요 미치겠다 마침 이 타이밍에 Xdinary Heroes 노래가 나옵니다 주현씨 곡 소개 부탁해요 이 노래는 최근에 나왔던 타이틀곡 ICU고요 네 이 노래 6540님이 신청해 주셨습니다.
GUEST,5188.59,5207.83,19.24,1,1,SPEAKER_05,X-DINNERY HEROES I SEE YOU ROCK'N'ROLL 이 도전걸로 위로 너에게 달려가는 중 가벼운 차에 과적상태 love 쏟아질도 위험하지만 I would never cry
AD,5264.34,5284.62,20.28,1,1,SPEAKER_04,타임 체크 포스트 체크 랩 체크 진다면은 헐 쉐이크 전체 일색 울려있는 전공 100% 납세기 외부 접속 금지 워닝 워닝 Oh hell no!
GUEST,5284.65,5286.67,2.02,2,1,SPEAKER_05,Don't shoot 이건 과심 격투징 So just let me show and prove 솔직함은 overuse Hey all you! Don't 망설이신다면 그냥 갖다 주세요
AD,5315.72,5416.05,100.33,9,5,"SPEAKER_07,SPEAKER_12,SPEAKER_13,SPEAKER_14,SPEAKER_15","사업장이 여러 갠데 매출, 매입, 지출, 계좌 현황을 한눈에 쉽게 볼 수 없을까? 여러 사업자의 격리 업무도 이제 한 번에 쉽고 편하게 격리회계 프로그램 세계 미술사를 바꾼 인상파의 원화가 노원에 옵니다. 모네, 고흐, 세잔, 르누아르까지 빛과 색채의 혁명을 만든 거장들의 원화를 놓치지 마세요. 노원아트 뮤지엄에서 12월 19일부터 5월 31일까지 지금 인상파 찬란한 순간들을 검색하세요. 살면서 제가 2시를 기다려본 적이 없는데 파디 덕분에 그래도 매일매일 힘을 얻는 것 같습니다. 파디 이제 곧 52시니까 야! 2시가 기다려지는 라디오 안녕하세요 여러분 항상 유쾌한 텐션으로 하루를 밝혀준 우리 하하 유쾌한 텐션으로 하루를 밝히는 라디오 슈퍼라디오 이제부터 더 잘하고 아빠가 영원하면 좋겠어요 청취자 여러분과 영원히 함께하고 싶은 라디오 KBS 쿨 FM 하하의 슈퍼라디오와 함께해주세요 판총물 대박날까 불안하네"
DJ/GUEST,5421.66,5464.98,43.32,7,2,"SPEAKER_05,SPEAKER_23",이윤지의 가을광장 이은지의 가요광장 4부 시작했고요. 오늘은 은지네 아이고 미안합니다. 내가 잘못했구나. 오늘은 은지네 편집쇼 우리 엄마 엄마가 엄마 엄마가 OMG 골든차일드 장준씨와 엑스티널리 히어로즈 정수씨 주연씨와 함께하고 있습니다. 정수씨 오늘의 주제 한번 읽어주세요.
DJ/GUEST,5465.16,5492.14,26.98,6,2,"SPEAKER_09,SPEAKER_23",오늘의 주제는 추억 소환 트렌드 다 돌려놔. 시원합니다. 추억 소환 트렌드 다 돌려놔 예능에 대한 이야기하고 있는데 이름이 너무 마음에 들어. 정윤슬리님께서 저는 엑스맨이요. 그 당시 천상지 스테파니님이 댄스 신고식에서 추는 춤 너무너무 멋있었던 기억이 있어요. 당연하지 게임도 너무 설레고 재밌었는데 아쉬워요.
DJ/GUEST,5492.16,5523.71,31.55,3,2,"SPEAKER_09,SPEAKER_23",그럼 당연하지 게임 한번 해봐야겠네요. 수 너 나 정말 사랑해? 당연하지 아 감사합니다 이런 멋진 bgm 너무너무 감사드리고 우리 밖에 있던 빌런지가 엄지를 저에게 들렀어 빌런지 오픈 수위 마이크 한번 열어줄게요 여러분 정수씨 사랑해도 돼요?
DJ/GUEST,5524.52,5545.47,20.95,3,3,"SPEAKER_02,SPEAKER_05,SPEAKER_23",빌런즈 사랑해요 안 들리나? 빌런즈 사랑해요 삐졌어 삐졌다 삐졌다 빌런즈 사랑해 숲이 졌다.
DJ/GUEST,5545.49,5552.02,6.53,6,2,"SPEAKER_09,SPEAKER_23",귀엽다. 귀엽다. 숲이 졌어. 큰일 났네. 김경호 님도 저희에게 문자 사연 주셨습니다. 주니.
DJ/GUEST,5552.26,5593.52,41.26,6,3,"SPEAKER_02,SPEAKER_09,SPEAKER_23",초등학생 때 학교에서 런닝맨 이름표 뜯기 따라하다가 수희 아저씨한테 많이 혼났어요. 진짜? 나중에는 문구점에서 이름표랑 방울 세트를 판매도 했던 기억이 있네요. 진짜 복도에서 하도 뛰어다녀서 혼나는 거 많았죠. 이런 걸 했었어요 이런 걸 또 재밌게 했었던 거 같고 아니 그건 그 얘긴 들었어요 그 텐디가 지구오락실에서 랜덤플레이 댄스를 추잖아요 그래서 실제로 아이들끼리 랜덤플레이 댄스를 하더라고요 아 진짜요? 유튜브에 랜덤플레이 댄스 음악 검색하면 그게 또 10초 단위 약간 후렴 부분들이 막 이렇게 편집되어 있어 그래서 그거를 신나게 했다니까요 되게 트렌디하네 신기했어 전인하님
DJ/GUEST,5593.5,5606.81,13.31,3,2,"SPEAKER_02,SPEAKER_23",정글의 법칙이요? 저는 김병만 님이 나오는 예능 프로그램을 좋아했는데 자연에서 먹을 것 찾아 먹고 동물들 보는 거나 아이돌들의 다른 면모를 볼 수 있어서 좋았어요. 이거 우리 준이가 이거 하면 100% 잘했을 텐데.
DJ/GUEST,5606.88,5610.22,3.34,2,2,"SPEAKER_02,SPEAKER_23",나 진짜 불러만 주면 진짜. 이런 거 좋아하잖아요.
DJ/GUEST,5610.24,5618.97,8.73,9,2,"SPEAKER_02,SPEAKER_23",정법 완전 좋아하죠. 이런 자연. 자연. 자연인이군요. 완전 네이처. 이런 채취. 채취. 채집. 채취?
DJ/GUEST,5620.15,5716.64,96.49,11,2,"SPEAKER_02,SPEAKER_23",미안해요. 채취요? 채집. 채취. 채취가. 정글의 법칙 추억이 납니다 우리 신랑님의 문자 산장 미팅 장미의 전쟁이요 너무 몰두해서 학원도 안 가고 최애 커플 안되면 울고 했답니다 옛날에 있었어요 소개팅 약간 지금의 나는 솔로나 환승연애나 그거를 연예인들이랑 같이 하는 그런 거였고 아니 나 얘기 들어보니까 우리 주현씨도 좋아하는 예능들이 많은 거 같아요 아니 먼 훗날 진짜 만약에 예능에 나간다면 아까 또 얘기해줬던 예능도 있지만 약간 얼굴이 약간 솔로 지옥상이야 솔로 지옥을 아직 한 편 더 본 적이 없어요 솔로 지옥 뭔가 쾌남이라서 물 속에서 나올 것 같아 그러면 일단 운동 더 해야 돼요 아직 너무 뼈 말랍니다 나는 솔로로 스노클링 끼고 나오면 안 되는 거예요 아니 그러면 주연씨는 요즘에 운동할 생각 없어요? 계획이 어때요? 아직까지는 안 생기는 것 같아요 아직까지는 근육도 되게 잘 붙는 사람이 있고 잘 안 붙는 사람이 있어 조금만 운동해도 막 붙는 사람이 있고 열심히 해도 잘 안 붙는 사람 제가 빨리 잘 붙는데 근데 빨리 빠져요 그러네 우리 또 주연씨 2026년 여름쯤에 기대 한번 해볼게요
DJ/GUEST,5717.21,5743.22,26.01,6,3,"SPEAKER_05,SPEAKER_08,SPEAKER_23",어떤 모습을요? 뭔가 더 쾌남된 모습? 더 쾌남? 어때요? 더 병향남? 긍정적인 검토 모성애 자극 이런식으로 아 그것도 괜찮고요 너무 좋지 긍정적인 검토 부탁한다 아 잠깐만 빌런즈 벗으라는 얘기는 안 돼요 벗으면 안 되죠 그건 안 돼요 빌런즈 꽁꽁 숨겨야 돼 아직은 꽁꽁 숨길게요 너무 추워요 자몽자몽헤니
DJ/GUEST,5743.2,5782.74,39.54,9,3,"SPEAKER_08,SPEAKER_09,SPEAKER_23",만 원의 행복이요. 일주일 동안 만 원으로 살아가기 위해 음식을 쪼개고 또 쪼개서 가격 측정하는 게 짠하면서도 재밌었어요. 출연자들의 일상도 재밌었고요. 근데 요즘 물가는 만 원으로는 택도 없겠죠. 그러네. 아 두바이 존드 쿠키 이거. 아 택도 없다. 그거 하나 먹으면 끝나요 끝나요 책도 없다 이게 도시락 싸서 주는 것도 있었어요 맞아 맞아 프로그램 안에 고마운 사람이나 친한 사람이나 도시락 싸서 주는 그런 코너도 있었는데 만약에 정수는 도시락을 싸서 누군가한테 줘야 돼 눈으로 얘기하는데 이제는 누구한테 주고 싶어요?
AD,5784.0,5784.06,0.06,1,0,,당연히
DJ/GUEST,5784.75,5801.07,16.32,6,3,"SPEAKER_05,SPEAKER_09,SPEAKER_23",당연히 누구? 빌런즈한테 줘야죠. 그럼요. 빌런즈가 몇 명이든 어디 있든 제가 다 싸서 들고 갑니다. 왜 벗으라고요? 내가 도시락을 주겠다는데 왜 벗어야 하지?
DJ/GUEST,5801.09,5858.65,57.56,8,2,"SPEAKER_08,SPEAKER_23",고마워요. 빌런즈. 오늘 이렇게 또 함께 이야기 나누고 있고 이번에는 레벨업 테스트 시간인데 이게 각종 예능과 관련된 문제들이 총 다섯 개 준비되어 있고 오늘 개인전이래요. 이게 원래.. 따로따로따로따로? 응 그런가봐요 이게 퀴즈인데 새해 첫 대결이고 이게 또 퀴즈고 또 끝나면은 또 벌칙이 있어서 굉장히 장준씨가 항상 최선을 다하는 그런 퀴즈 시간이에요 정색하고요 진짜 오늘 후배들인데 어떻게 봐줄 생각은 없는거죠? 없음 둥 알겠지비 알겠지비 주현은 어때요? 요런거 좀 해봤어요? 제가 다른 거는 다 괜찮은데 트렌드랑은 연관이 없는 사람이라서 좀 걱정돼요 속세에서 벗어나 있는 사람이라 좀 열심히 노력은 해보겠습니다 오케이 멤버들이랑 이런 퀴즈는 많이 안 해봤죠 그쵸
DJ/GUEST,5859.05,5865.0,5.95,2,2,"SPEAKER_09,SPEAKER_23",수 어떻게 자신 있어요? 저는 자신이 있다기보다는 심판이 계시지 않나요?
DJ/GUEST,5865.32,5923.7,58.38,7,2,"SPEAKER_09,SPEAKER_23",내가 심판이에요 심판을 믿어요 미치겠다 오늘은 편파 판정 없이 정말 최선을 다해서 해보도록 하겠습니다 수 때문에 정신을 못 차리겠어요 괜찮아요? 정준씨 괜찮아요? 누나 혼자 남매 프로그램 보고 있는 느낌 나겠어요 조금만 버텨줘요 첫 번째 문제 갑니다 어렵다 2005년부터 2007년까지 방송됐던 해피투게더 프렌즈라는 프로그램에 대한 문제인데요 코너 중에 하나가 숨은 친구 찾기였고요 출연한 연예인이 나와있는 사람들 중에 친구인 것 같은 사람에게 친구야! 라고 손을 내밀어요 그럼 이때 진짜 어린 시절의 친구가 맞으면 상대가 반갑다 친구야 이렇게 대답을 하거든요 그렇다면 가짜 친구는 뭐라고 대답했을까요? 와 이거 아는데 모르겠다
DJ/GUEST,5924.2,5929.37,5.17,4,2,"SPEAKER_08,SPEAKER_23",어? 그러게? 반갑다 친구야. 죄송합니다.
DJ/GUEST,5929.39,5944.58,15.19,4,2,"SPEAKER_02,SPEAKER_23",진짜친구면은 친구야 라고 했을때 진짜친구면은 반갑다친구야 라고 하고 친구야 했을때 가짜친구면은 이런 대답을 해요. 장준씨 뭘거같은? 나 아는데 근데 기억이 안나네 그것만. 반갑다친구야만 기억나네.
