block_type,start,end,duration,segments,speaker_count,speakers,text
AD,0.03,27.41,27.38,2,2,"SPEAKER_06,SPEAKER_16",이 캠페인은 환경부와 환경책임보험사업단이 함께합니다. 고객들의 마음을 사로잡기 위해 SBS 라디오와 함께하세요.
DJ,49.09,128.62,79.53,12,1,SPEAKER_03,박하선의 시내 타운 영화 프로포즈데이에서 에나의 아파트에 화재의 경고음이 삐- 울립니다. 얼른 중요한 것만 챙겨서 나가야 해요. 좋은 아파트에 고가의 물건들이 한가득 하지만 정작 에나가 원하는 건 그 안에 없습니다. 늘 성공만을 위해 발버둥치던 에나는요. 그때 깨닫습니다. 내 인생에 가장 중요한 건 이곳이 아닌 저 멀리 아일랜드에 있는 그 사람이란 걸요. 그날 에나의 마음속 점등이 화재 경고음과 함께 찾아오죠. 만약에 라는 말이 의미가 없는 것 같아도요. 이렇게 극한의 상황을 상상하면 복잡한 답이 명료해집니다. 만약 지금 화재 경고음이 삐 하고 울린다면 여러분은 어떤 걸 가장 먼저 찾으실 건가요? 안녕하세요. 박하선의 시내타운 박하선입니다.
MUSIC,142.09,171.16,29.07,1,1,SPEAKER_09,You stuck on me in my laughing eyes I can't pretend though I tried to hide I like you I like you I think I felt my heart skip a beat I'm standing here and I can hardly breathe You got me You got me
DJ,374.86,515.81,140.95,23,1,SPEAKER_03,11월 25일입니다. 월요일이네요. 박하선의 시네타운 첫 곡은 영화 프로포즈데이에서 콜비 카레이의 You Got Me였습니다. 2010년에 개봉한 영화입니다. 프로포즈데이 아넌드 터커 감독의 작품이고 에이미 아담스 매튜 구드가 출연을 했어요. 아일랜드에는 4년에 한 번 돌아오는 2월 29일 여자가 남자에게 프로포즈를 하면 무조건 승득해야 하는 풍습이 있대요. 와우 세상에나 무섭다. 이걸 수제로 오래 사귄 남자친구와 결혼을 위해 그가 출장 간 아일랜드까지 찾아가 프로포즈를 하려는 주인공 에나의 이야기를 담았습니다. 아일랜드의 아름다운 풍경을 마음껏 볼 수 있는 영화 원스도 그렇고 이렇게 예뻐 보여서 꼭 한번 가보고 싶은 나라인데 아직 못 가봤네요. 저는 이거 아이도 있고 하니까 저는 메모장에 적어 놨는데 전 만약에 화재경보 뭐 이렇게 전쟁이 터지거나 급한 상황이 있다 그러면 일단은 카드만 챙겨서 패딩만 챙겨서 아이 들춰놓고 나가야지 그 생각을 하고 있거든요 그래서 빨리 뭐가 끊기기 전에 빨리 돈을 뽑아야지 근데 이게 가다 막히면 어떡하나 그래서 현금도 좀 뽑아 놓고 있거든요 그 현금 이제 장례식이나 결혼식 때 또 계속 쓰다보면 또 줄고 사람이 제일 중요해. 제 딸이나 빨리 들첩고 도망갈 것 같아요. 자 잠시 후 2부엔 여러분의 영화 차트로 꾸며드리는 베스트 차트의 히어로 줄여서 배트맨이 기다리고 있습니다. 우리 테리우스들이 뽑은 겨울 영화 베스트 3로 함께 할게요. 한 번 전에 번개가 엄청 크게 쳤는데 저는 그게 순간 전쟁인가 이래서 한번 어? 어떡하지? 딱 생각이 막 머리가 확 돌아간 적이 있는데 그때 남편은 저쪽 어디 다른 동네에서 회식을 하고 있었거든요. 근데 그때 딱 생각이 들었어요. 모르겠고 딸이나 빨리 데리고 도망가자고 했어요. 이렇게 중요한 순간에 그런 생각이 나는 것 같아요. 왜냐하면 그는 잘 도망갈 테니까 나중에 만나면 되죠. 하고 싶은 이야기 듣고 싶은 노래가 있으시다면 무료인 고릴라나 샵 1077 짧은 건 50원 긴 건 100원의 유료 문자로 보내주세요.
AD,515.87,722.55,206.68,45,8,"SPEAKER_00,SPEAKER_01,SPEAKER_06,SPEAKER_07,SPEAKER_10,SPEAKER_20,SPEAKER_21,SPEAKER_22","그럼 광고 듣고 다시 만나요. 이제 연금도 투자다. N2 퇴직연금. 역시 고용노동부가 선정한 2024년 퇴직연금 우수사업자. MH투자증권. 원금 손실 유의. 가입 전 상품설명서 및 약관 필독. 안녕하세요. 이재훈입니다. 가장 살기 좋은 집이 되도록 가장 빛나는 삶이 펼쳐지도록. 삶을 움직이는 집. 동문 디이스트. 초중고 학습권과 도보 10분 문산역. 문산의 중심. 문산역 3차 동문 디이스트 센트럴. 현본주택 개관 중. 031-651-7733. 한 회사를 똑같이 다녔는데 동기보다 내가 세금도 많이 내면 속이 타 안 타. 그럼 갈아타. 삼성증권 퇴직연금으로 연말 정산 최대 900만 원까지 공제받으니까 당신의 연금력이 커집니다. 삼성증권 투자 전 상품 설명서 및 약관 필터 원금 손실 발생 가능 및 투자자 비속 보수는 연 0.24에서 0.3%이며 홈페이지 참고 안녕하세요. 신한 프리미어 모델 김수현입니다. 여러분께 특별한 자산관리를 소개합니다. 투자, 법률, 세무, 부동산 각 분야 전문가들이 당신만을 위한 맞춤 솔루션을 찾아드립니다. 지금 만나보세요. 자산관리는 신한프리미어 새 차 타고 싶은 사람들 주목! 현대의 자동차를 구매하는 새로운 비법! 이름하여 안심 플러스 할부! 중고차 잔가를 70%까지 보장! 차값의 3분의 1만 매달 부담없이 나눠내고 2년 뒤엔 타던 차를 그대로 반납하면 되니 완전 초대박! 자세한 내용은 지점 대리점 문의! 여러분, 위기 상황으로 어려움을 겪고 계신가요? 혼자 고민하지 마시고 긴급복지 지원을 요청하세요. 생계, 의료, 연료비 등을 지원받으실 수 있습니다. 자세한 사항은 국번 없이 129로 문의 바랍니다. 보건복지부가 힘이 되어드리겠습니다. 안녕하세요. 윤종실입니다. 이정하입니다. 탄탄한 내일을 위해 함께 들어볼까요? 롯데 롯데 롯데비지랑탈 11월 새로운 시대가 시작됩니다. 살고 일하고 즐기고 쉬고 누리고 거대한 원안에 당신의 삶을 모두 담은 서울원에서 만나는 라이프 컬처 시대 서울원 아이파크 HDC 현대산업개발 영화네 방울방울"
DJ,727.65,860.68,133.03,22,1,SPEAKER_03,"그날의 영화 그 안의 추억 하림님이 보내주신 사연이에요. 20대 초반에 저는 영화관에서 아르바이트를 했습니다. 당시 마감 시간대에 일하면 시급을 조금 더 받을 수 있어서 저는 주로 마감 시간대 스텝으로 일을 했어요. 영화, 괴물, 타짜, 악마는 프라다를 입는다, 새끼 등등. 지금 생각해보니 정말 명작들이 많이 개봉했던 시기였네요. 그땐 신작 영화가 개봉을 하기 전에 필름 테스트라는 걸 했어요. 영화관 마감 후 다음날 개봉하는 신작 영화를 미리 보면서 이 필름에 잡티는 없는지 음향 상태는 괜찮은지 체크하는 일이었습니다. 마감 시간대에 근무하는 스태프 수는 많지가 않아서요. 보통 한 상영관당 한 명이나 두 명 정도 들어가서 영화를 봤죠. 개봉 전 영화를 미리 보는 거니까 스포 하나 없이 누구보다 영화를 빨리 볼 수 있는 절호의 기회였습니다. 하지만 한편으로는요. 넓은 상영관에서 홀로 영화를 봐야 하니 무서울 때도 있었어요. 특히 공포 영화 볼 때요. 필름 체크를 해야 하니 아무리 무서워도 절대 눈을 가리면 안 되고 소리도 정확하게 들어야 하니 귀도 막지 못했습니다. 당시 제가 맡았던 영화 중에 소우가 있었어요. 너무 무섭고 잔인해서 몇 번이나 눈을 칠끔 감고 싶었지만 저는 두 눈 똑바로 뜨고 소우를 처음부터 끝까지 다 봤습니다. 그날... 이상하게 집에 혼자 가는 게 무서워서 영화관 스태프 친구들이랑 고갈비에 소주를 마시고 첫 차를 타고 집에 갔던 게 생각나요. 그때 참 좋았어요. 학교 수업 듣고 아르바이트하고 영화 보고 친구들이랑 술도 마셨는데 체력이 무궁무진한 느낌. 그 느낌 참 좋았는데. 혼자 보는 공포영화보다 현실이 더 무섭다는 사실을 알게 된 지금 숙취도 모르고 놀았던 그 시절이 참 그립네요"
AD,892.97,911.07,18.1,1,1,SPEAKER_09,시청해주셔서 감사합니다.
DJ,963.73,986.8,23.07,6,1,SPEAKER_03,"영화 소우에서 헬로우 잽 듣고 왔습니다. 음악만 들어도 무섭네. 2005년에 개봉한 영화입니다. 소우 컨저링 아쿠아맨을 만든 제임스 완 감독의 작품. 리 원엘, 켈리 엘 위스가 주연을 맡았습니다. 어느 캄캄한 지하실."
AD,986.82,990.45,3.63,1,1,SPEAKER_06,발목에 쇠줄이 묶인 채 마주하게 된 아담과 거든.
DJ,991.05,1092.03,100.98,19,1,SPEAKER_03,"정체불명의 범인이 8시간 내에 고든이 아담을 죽이지 않으면 고든의 가족들까지 해치겠다는 경고를 하면서 벌어지는 이야기를 담은 공포영화. 우리 때 난리였는데 참 재밌었는데 좀 새로웠어요. 시사회를 저는 먼저 봐서 참 좋아하는데 이런 기분이었을 것 같아요. 우리 쓰니 지은이분. 재밌었겠어요. 그러게요. 대학교 때는 진짜 6시까지 술 마시고 잘만 들어갔는데 동의. 동의 찍을 무렵에 20대 초반이었는데 그때는 새벽 한두시에 리딩하느라 모이면 5시쯤 슛이 들어가고 점심쯤에 끝나요 그러면 자야 되잖아요 근데 그렇게 낮술을 먹으면서 친해졌거든요 그 팀을 아직도 만나요 그렇게까지 잘 먹고 살았는데 이게 요즘에 한 두세 시간 지나면 회식 시간에 집에 가고 싶어지더라고요 영화 열킨 이렇게 재밌는 사연들 보내주세요. 시내타운 홈페이지 들어오셔서 게시판에 남겨주시면 됩니다. 사연 소개된 분들에게는 백화점 상품권 드립니다. 영화는 방울방울은 카페인 부담 없이 맛과 향은 그대로. 맥심티 카페인 커피 믹스와 함께해요. 박하산의 시내타운에서 준비한 문화 선물입니다. 보고 싶은 작품 문자 또는 고릴라로 신청하세요. 아니면 시내타운 홈페이지에 문화선물 게시판에 댓글로 남겨주세요. 영화 1승 예매권, 영화 리바이벌 69 예매권, 영화 아들들 예매권을 드립니다. 영화 고스트버스터즈에서 레이 파커 주니어의 고스트버스터즈 듣고 우린 다시 만나요."
MUSIC,1130.29,1196.57,66.28,2,1,SPEAKER_08,I ain't afraid of no ghost I'm afraid of no ghost I'm afraid of no ghost
AD,1209.44,1221.57,12.13,2,1,SPEAKER_08,고맙습니다. 고맙습니다.
MUSIC,1261.74,1284.76,23.02,1,1,SPEAKER_08,"I ain't afraid of no ghost Don't get caught in line, oh no"
AD,1289.18,1342.49,53.31,2,1,SPEAKER_08,고맙습니다. 고스트버스터즈에서 고스트버스터즈 듣고 왔어요.
DJ,1343.47,1464.92,121.45,19,1,SPEAKER_03,우리 은정님은 어제 직장에서 숲으로 산책을 갔대요. 와우 알려지지 않은 곳인 줄 알았는데 다들 어떻게 알고 산책을 하시더라고요. 앞으로 답답한 일이 있을 땐 자주 가서 산책해야겠다. 3638님은 캔디 열대어 구피를 기르고 싶다고 해서 아이가 6마리 분양받았어요. 집에 다른 열대어도 있는데 자꾸 늘어나서 큰일이네요. 청소하는 건 제 몫인데 아이가 좋아하니 자꾸 늘어나요. 어이구 저희 집에 어학만 5개라고. 저희 집도 거북이를 저 몰래 두 분이서 들여왔는데요. 키우다 보니까 개 같기도 하고 돼지 같기도 하고 와서 밥 달라고 꿀꿀꿀 하거든요. 귀엽긴 하더라고요. 근데 이거 참 일이에요. 응가를 많이 싸니까 치워줘야 되잖아요. 참 일인데 또 귀엽기도 하고. 아 이게 어쩔 수가 없어요 아이가 좋아하면 동숙님은 아침에 시외버스 타야 해서 허기도 채울 겸 빵을 샀대요 제 거 사면서 어머 기사님 드릴 것도 하나 샀대요 버스 타면서 드렸더니 너무 좋아하면서 감사하다고 인사하시네요 소소한 거 타는데 어우 이런 건 처음이다 이런 마음이 세상에 이렇게 모두가 행복해지네요 하셨어요 아침 드세요 이렇게 드렸나요 와 너무 세상에나 정이 있네요. 우리 2170님은 아들이 국방의 의무를 다하러 갔습니다. 입영식 후 집으로 돌아와 아들 방문 앞에서 서성였어요. 금방이라도 엄마 배고파 하면서 나올 것 같아서요. 갱년기라 겹쳐서 그런지 눈물 버튼이 계속 가동 중이네요 택배가 온다는데 아들이 입댄 날 입고 간 옷이 올 것 같아요 이렇게 돌려주는군요 벌써 가슴이 울컥하네요 하셨습니다 또 금방 우리 휴가 나오길래요 우리는 영화 필라델피아에서 브루스 스프링스틴의 Streets of Philadelphia 듣고 2부에서 배트맨을 만나볼까요
AD,1589.77,1993.88,404.11,30,9,"SPEAKER_00,SPEAKER_05,SPEAKER_06,SPEAKER_07,SPEAKER_12,SPEAKER_15,SPEAKER_17,SPEAKER_18,SPEAKER_19","한글자막 by 한효주 한글자막 by 한효주 닥터피엘과 함께하는 SBS 캠페인 물은 생명이다. 우리나라의 수돗물은 깨끗하기로 유명하죠. 특히 한국의 수돗물은 59개 기준에 따라 정수처리를 했기 때문에 원수의 수질이 매우 깨끗하다고 합니다. 다만 상수도관이 오래된 곳들은 수돗물이 낡은 수도관에 통과하면서 녹물과 같은 불순물들이 섞여 나올 수 있으니까요. 이런 경우 가정에서는 필터가 있는 샤워기나 주방용 수전 등의 제품을 사용해보면 어떨까요? 깨끗하게 정수된 수돗물을 걱정 없이 사용할 수 있을 겁니다. SBS 캠페인 물은 생명이다. 우리 가족 깨끗한 물 이중필터 샤워기 닥터피엘과 함께합니다. 지키고 싶은 연인, 가족, 우리 아이, 건강, 농업 그리고 지구를 위해 나와 지구 우리 모두를 지키는 방법 커져라 친환경 농산물 지구를 지키는 농부와 친환경 농산물 자조금관리위원회가 함께합니다. 바다의 맛이 살아있는 구룡포 푸짐한 먹거리와 즐거움이 가득한 축제의 현장으로 여러분을 초대합니다. 11월 2일부터 12월 15일 매주 주말 오감을 만족시키는 구룡포 해양미식축제 놓치지 마세요. 구룡포 해양미식축제 안녕하세요 박재범, 이창섭입니다. SBS 글로벌 보이그룹 어댓인 유니버설리그가 11월에 찾아옵니다. 글로벌 케이팝 아이돌 데뷔를 위한 치열한 드림매치, 소년들의 여정에 함께해주세요. SBS 유니버설리그는 매주 금요일 밤 11시 20분에 방송됩니다. 렛츠고! 그 수많은 날들 중 어느 날에 우린 만났다. 지구상 마지막 킴바이 코뿔소 노든과 그의 품에서 태어난 어린 펭귄의 바다를 찾아 떠나는 여정 뮤지컬 긴긴밤. 10월 15일부터 1월 5일까지 링크 아트센터 드림 드림 2관에서 초등학생 이상 관람가. 전국의 사장님들을 위한 세 글자 스피드 퀴즈 1위 라디오 채널은 SBS 1등 인터넷 라디오는 고릴라 두당없는 비용으로 고릴라에 광고하면 뭐가 쑥 매출 광고기 가성비 갑 지금 바로 고릴라 광고를 검색해보세요 고릴라 랄랄랄랄라 랄랄랄랄라 랄랄랄랄랄라 고릴라 SBS 생활정보 전국의 하늘 맑은 가운데 오후부터 차차 흐려지겠고 오늘 밤 서쪽 지역에 비가 시작돼서 내일 새벽에는 전국으로 확대되겠습니다. 오늘 늦은 밤에 서울 경기 내륙과 충남권 내륙에 빗방울 떨어지는 곳도 있겠는데요. 오늘 밤부터 내일 새벽 사이 제주도에는 시간당 30mm 내외의 강한 비가 오늘 낮 기온은 서울이 15도, 대구가 16도, 광주가 17도로 어제와 비슷하겠습니다. 하지만 내일 오후부터는 찬 공기가 유입되면서 모레 아침 기온 큰 폭으로 떨어지면서 추워지겠습니다. 고객의 생활을 편리하게 초혁신 디지털금융 NH농협은행과 함께합니다. 박하선의 시내타운 감사합니다."
DJ,2041.92,2318.49,276.57,64,1,SPEAKER_03,영화 김종욱 찾기에서 블루시티 듣고 왔습니다. 베스트 차트의 히어로 이름하여 배트맨 이 시간의 히어로는 여러분들입니다. 이상하게 이 시간만 되면 이렇게 목소리가 이렇게 성우톤으로 해야 될 것 같아요. 여러분의 베스트 영화 차트로 꾸며지는 이르마야 배트맨. 시내타운을 여러분의 영화 베스트 차트로 밝혀주세요. 오늘의 주제는 겨울영화 베스트3입니다. 오늘 방송 들으시면서 다가올 겨울 어떤 영화를 보면 좋을지 리스트 정리하셔도 좋겠네요. 그리고 선물이 쏟아지는 퀴즈도 함께하고 있습니다. 배트맨은 인별그램으로 주제를 공지하고 있어요. 오늘도 미리 여러분이 뽑은 겨울영화 베스트3를 받아 봤습니다. 이거 진짜 웃겼잖아요. 제가 이거를 제 SNS에 공지를 했더니 선물 받아가라고 많이 쓰고 저랑 최근에 드라마를 찍은 조감독님이 글을 남긴 거 봤는데 정말 영화만 띡띡띡 세 개 써놓은 거예요. 그러면 안 뽑힐 텐데 뭔가 이렇게 쭈절쭈절 이렇게 이 영화가 좋은 이유 이런 거를 쫙쫙쫙 쓰셔야 뽑을 텐데 참 안타까웠습니다. 너무 재밌었어요. 첫 번째 배트맨은요. 바로 쿠준 님이네요. 고구마 라떼 교환권 보내드립니다. 딱이죠 지금 날씨. 3위. 전두현 공유주연의 남과 여. 눈 쌓인 핀란드의 설경이 참 예뻤습니다. 거기다 핀란드의 사우나도 색다르고 낭만적이었다고. 이 영화 은근히 이렇게 뽑아주시는 분이 많더라고요. 전 보면서 좀 되게 특이하다라고 생각한 영화인데 이 영화 좋아하시는 분들 참 많은 것 같아요. 비슷한 결로 그거 있죠. 무례한 이렇게 약간 매니아층이 좀 형성이 돼 있는 것 같아요. 근데 매니아라고 하기엔 많이들 좋아하시는. 그리고 2위는 캐롤. 겨울 영화 하면 빠질 수 없는 영화 캐롤. 케이트 블란첵과 루니 마라의 겨울 의상도 눈에 띄고 OST도 참 좋았어요. 자 그럼 이분의 대망의 1위는 뭘까요? 바로바로 윤희에게였습니다. 와우 진짜 겨울 느낌이 물씬 물씬 나는 영화들을 가지고 오셨네요. 킨디도 좋아하는 영화라고 들었어요. 이 영화를 본 후로 눈을 밟을 때면 영화 속 김희애 씨가 눈밭에 서 있는 그 모습이 떠오른다고. 이 영화도 참 좋았죠. 아 나 요쯤에 글로 가보고 싶은데 저 아는 분이 최근에 삿보로 가 있다는데 너무 부러웠어요. 여긴 오타로였나요? 자 그럼 우리 두 번째 배트맨 모셔볼게요. 바로 구환김입니다. 고구마라떼 교환권 드리면서 우선 3위. 겨울왕국. 아 뭐 원래 뻔한 선택이 가장 대중적인 선택이잖아요. 그래서 고른 영화입니다. 겨울왕국. 빼놓을 수 없죠. 차디찬 겨울의 시림을 보여주지만 결말은 따뜻하고 훈훈했죠. 그리고 2위는 다이하드2. 영화 속 눈발 서늘한 뉴욕의 존 F 케네디 공항. 전 언제 한번 가볼 수 있으려나요? 캔디는 가봤어요? 가봤죠 가봤죠 가봤죠. 딱 지금 날씨에 가면 춥고 좋아요. 그 센트럴 파크를 거니르면서 저도 시간 없어서 딱 6일 만에 이리 잡혀서 돌아왔었는데 참 맛있었고 뭘 먹어도 다 맛있더라고요. 어릴 때라 무슨 치즈케이크 맛집 찾아다니고 컵케이크 맛집 이런 거 찾아다녔는데 베이글 맛집. 근데 베이글은 요즘에 한국에 많이 들어와 있는 베이글들 우리나라 토종 베이글들이 더 맛있더라고요. 아무튼 좋습니다. 자 그럼 이분의 대망의 1위는 이터널 서샤인 아 맞아요 딱이죠. 얼어붙은 저수지에 짐 캐리와 케이트 윈슬렛이 누워서 하늘을 보잖아요. 그 알싸한 겨울 분위기. 거기다 기억을 없애버리는 서늘한 스토리도 겨울을 연상시키는 영화였죠. 아우 참 춥죠 이 영화.
AD,2319.14,2347.82,28.68,1,1,SPEAKER_14,"영화 다이아두2에서 Let it snow, let it snow, let it snow 로비 윌리엄스의 목소리로 듣고 우리 다시 만나요 Let it snow, let it snow, let it snow"
MUSIC,2409.26,2436.07,26.81,1,1,SPEAKER_14,"I hate going out in the storm But if you really hold me tight All the way home I'll be warm The fire is slowly dying And my dear we're still goodbying But as long as you love me so Let it snow, let it snow, let it snow"
DJ,2443.67,2511.29,67.62,20,1,SPEAKER_03,겨울영화 베스트3 함께하고 있죠? 마지막 배트맨은 말딩시비님입니다. 고구마 라떼 교환권 드리고요. 3위부터 소개해드려볼게요. 3위는 닥터 지바고. 와 진짜 오랜만이네요. 어린 시절 명화극장에 겨울이 되면 나왔던 닥터 지바고. 쓰고 나오던 털모자가 기억에 남는다고. 아 약간 이 러시아 같은 이런 모자. 2위는 나니아 연대기. 옷장을 열면 눈밭에서 펼쳐지는 판타지 영화가 환상적이었어요. 특히 마녀가 너무 아름다워서 놀라웠죠. 전 요즘도 옷장을 볼 때면 혹시 옷을 들추면? 이런 생각을 한답니다. 이분 굉장히 순수하시네요. 이제 마지막 1위 영화를 맞춰주시면 됩니다. 이 영화를 보지 못한 분들도 이 대사는 아마 아실 거예요. 사랑은 미안하다고 말하는 게 아니야. 제니와 올리버가 다툰 후 올리버가 사과를 하니까 제니가 한 말입니다. 그 명장면 우리 함께 들어볼까요?
AD,2515.17,2523.4,8.23,1,1,SPEAKER_09,제니가 사과를 하니까 제니가 한 말입니다.
DJ,2527.72,2593.42,65.7,14,1,SPEAKER_03,1971년에 만들어진 겨울 영화의 클래식 눈밭을 뛰어다니는 남녀 그리고 사랑은 미안하다고 말하는 게 아니야란 명대사의 영화 이 작품은 뭘까요? 샵 1077 짧은 건 50원 긴 건 100원의 유료 문자 혹은 고릴라로 보내주세요. 다섯 분을 뽑아서 선물 쏩니다. 미안하단 말 안 하면 어떡해요. 사랑하는데 미안하단 말 안 하면 화나지. 지금 생각해보니 그러네요. 이때는 되게 멋있어 보였는데 이 대사가. 자 그리고 지금 인시네타운의 인별그램에 놀러오시면 다음 주 월요일 배트맨 주제 슬픈 이별 영화 베스트 3가 공지되어 있어요. 벌써부터 감성 충만 충만하네요. 임별그램 골뱅이 sbscine sbscine로 들어와서 댓글 많이 많이 달아주세요. 소개된 모든 분께 선물 드려요. 이 영화가 왜 좋은지 사연까지 붙여주시면 뽑힐 확률이 더 높겠죠. 정답인 이 영화에서 한 곡 들을게요. 스노우 플로리 이 곡 듣고 우리 다시 만납시다.
AD,2606.83,2938.19,331.36,38,7,"SPEAKER_02,SPEAKER_07,SPEAKER_09,SPEAKER_10,SPEAKER_11,SPEAKER_13,SPEAKER_19","감사합니다. 감사합니다. 가마치 마치 너무 맛있지 친절하고 맛있는 가마치 완벽한 치킨 하나 둘 셋 넷 가마치 마치 가마치 통닭 가마치 마치 크리스마스엔 따끈한 가마치 통닭 고려기부터 선수교체 매출 쭉쭉 성과 쭉쭉 반쪽물을 고려하라 고려기부터 고려기프트 고려기프트 단천물을 고려하라 공공기관 우선구매 대상기업 고려기프트 건너오세요 당신의 퇴직연금이 원하던 글로벌한 세계로 내 연금상품 그대로 중도해지 없이도 실물이 저는 지금이다 수익률이 중요한 퇴직연금은 글로벌 투자하는 연금 미래의셋증권으로 원금 손실 유의. 투자 전 상품 설명 서민 약관 필독. 아 병원 갈 때 신분증 챙기기 귀찮아. 괜찮아. KB 스타뱅킹이 있잖아. 병원 접수할 때는? KB 스타뱅킹이면 괜찮아. 여권 재발급도? KB 스타뱅킹이면 괜찮아. 국내선 비행기 탈 때도? KB 스타뱅킹이면 괜찮다니까. 신분증 챙기기 귀찮은 모든 순간. 지금 KB 스타뱅킹에 신분증을 넣어보세요. KB 국민은행. 대한민국 지역균형 발전의 미래. 태만금 수변 도시가 2025년 모습을 드러냅니다. 경제, 문화, 교육, 여가가 어우러지는 새만금 수변 도시는 차별화된 가치를 제공하며 대한민국 미래 도시로 발돋움할 것입니다. 이 광고는 새만금개발공사와 함께합니다. 코코코지마 끝까지 시원하죠 코코코 코지마 머리 끝 발끝까지 코코코 코지마 뭉치고 뻐근할 땐 누워만 있으면 피로가 스르르 장윤정의 안마의자 코지마 코코코 코지마 코지마 안마의자 안녕하세요 신한 프리미어 모델 김수현입니다 여러분께 특별한 자산관리를 소개합니다 투자, 법률, 세무, 부동산. 각 분야 전문가들이 당신만을 위한 맞춤 솔루션을 찾아드립니다. 지금 만나보세요. 자산관리는 신한프리미어. 아빠, 이제 담배 냄새 안 난다. 전자담배, 처음엔 좋았습니다. 절 피하지 않으니까요. 우와, 이 냄새 뭐야? 근데 이제 무섭습니다. 피하지 않으니까요. 피하지 않아 더 위험한 전자담배. 전혀 괜찮지 않은 담배입니다. 대한민국이 가장 좋아하는 1등 라디오 SBS 파워 FM. 잠시 후 12시부터 즐거운 오후의 시작. 12시엔 주현영이 방송됩니다."
